Note,Commentaire
3.0," Lion est le film attendu suite à cette image de machine lacrymale à Oscars véhiculée par sa promotion. Une histoire à la fois triste et pleine d'espoir qui ne peut avoir qu'une conclusion destinée à nous émouvoir.Dans le Calcutta des années 80, un petit garçon de 5 ans, Saroo, se retrouve perdu, éloigné de sa famille après s'être endormi dans un train. Pourtant, son frère lui avait bien dit qu'il devait rester sur le banc ! Bref. D'entrée de jeu, et c'est peut être là, la meilleure partie du film, on est plongé comme ce gosse dans l'enfer d'une ville étouffante et surpeuplée où les enfants des rues n'ont que de tristes perspectives d'avenir. Malgré les recoins très sombres de l'humanité qui sont mis en avant dans la petite enfance de Saroo, le réalisateur fait le choix bienvenu de ne suggérer que l'horreur en s'en remettant aux ravages très visuels causés sur ces enfants. Mais notre petit héros à la gueule d'ange qui ne peut que gagner l'adhésion de tous les yeux posés sur lui aura finalement bien plus de chance que les autres. Et, lorsqu'une nouvelle vie lui sourit, c'est avec une ellipse XXL, que nous quitterons son enfance pour nous retrouver bien plus tard face à un jeune adulte accompli. Enfin, presque...Voilà. A partir de là, chargez les émotions dans une quête de vérité jusqu'à un final forcément touchant. Les acteurs sont justes, très justes et la permanente de Nicole Kidman vaut presque une étoile à elle toute seule. D'ailleurs au final, c'est uniquement le casting qui porte cette énième histoire de foi en l'humanité malgré tous ses travers. On pense à ""Va, vis et deviens"" qu'on pourrait renommer dans ce cas ""Va, vis et reviens"" tant la construction de l'homme qu'est devenu Saroo se limite à l'obsession qu'il va développer pour retrouver sa mère. Car pour ma part, bien au delà de cette quête, ce sont les scènes avec son frère adoptif et la relation avec ses parents qui méritaient d'être approfondies.Un film qui se laisse apprécier mais qui ne mérite peut être pas tous ses lauriers et qui nous laisse avec une seule question en tête : ""Mais pourquoi t'es pas resté sur ce putain de banc ?"" "
5.0," Un film bouleversant d'humanisme , parfois triste mais surtout très riche en émotions ! Une histoire incroyable et pourtant vraie. Un vrai moment de régal ! À voir "
5.0, Une véritable petite merveille ce film.Des acteurs parfait. Une ambiance prenante du début à la fin. Une musique parfaitement dans l'ambiance. Émouvant et beau ce film ne laisse pas indifférent. 
3.5," Qui n'avait pas été ému en voyant ""Slumdog millionnaire"" ? Qui ne le sera pas cette fois en découvrant le premier long-métrage du cinéaste australien Garth Davis ? Bien sûr on pouvait craindre la recette : on ressort l'acteur principal du film culte de 2009, Dev Patel, et on ausculte avec plus ou moins d'adresse la réalité sociale de l'Inde d'aujourd'hui, avec en première ligne l'enfance, toujours émouvante à souhait surtout lorsqu'elle est misérable. Le scénario qui plus est est tiré d'une histoire vraie, celle d'un petit garçon, Saroo, originaire d'un village de l'Inde et qui, voulant suivre son grand-frère sur les lieux de son travail, va s'égarer et vivre une aventure rocambolesque digne des romans de Dickens. Parvenu à Calcutta, loin, très loin de chez lui, il finit par être adopté par un couple d'Australiens. Mais halte là, nous n'en dirons pas plus... Si la première partie qui pose les jalons de l'intrigue en Inde est tout bonnement stupéfiante par sa mise en scène et son sens dramatique, nous n'en dirons pas autant de l'épisode tasmanien qui se fait bavard et dont le rythme lent a quelque chose de lassant, d'autant que le couple d'acteurs incarnant les parents adoptifs - pardon pour Nicole Kidman ! - ne brillent guère par leur expressivité. On les sent fatigués et peu convaincus du bien-fondé de leurs rôles. Heureusement que Rooney Mara est là pour sauver la mise et donner le souffle nécessaire à cet épisode peu inspiré. On n'attend dès lors qu'une chose : le départ de Saroo devenu un grand et beau jeune homme pour son Inde natale. Et le film dès lors retrouvera ainsi mais tardivement son esprit de départ. Que dire encore sinon que le film arrachera des larmes au spectateur le plus insensible et que de ce point de vue la musique est parfois irritante tant son dessein est bien sûr d'en remettre une couche. Il n'empêche que ""Lion"" est un film de qualité, fort en sentiments et en émotions et qu'il nous présente trois acteurs remarquables : Dev Patel, Sunny Pawar dans le rôle de Saroo enfant et Abhishek Bharate dans celui de Guddu, le grand-frère tant aimé de l'enfant et séparé à tout jamais. "
4.0," Lion est un film qui transporte littéralement, on rentre très facilement dans l'histoire qui est touchante et de plus vraie. On passe à travers diverses émotions mais surtout les pleurs que je n'ai pas pu retenir à la fin du film.. "
4.5," Pendant que Moonlight et La La Land se battaient pour obtenir l'Oscar du meilleur film, Lion aurait largement pu l'emporter tant, selon moi, il a survolé deux films certes plutôt bien réalisés mais dont l'émotion limitée les rendaient obsolètes. Lion dans une aventure d'un petit garçon qui se perd et qui se fait adopter par une famille australienne qui recherche sa mère et ses frères et soeurs, avait tout pour émouvoir le public. Et c'est véritablement le cas. Kev Patel offre peut-être l'un des rôles les plus émotionnels de sa filmographie. Malgré quelques longueurs, notamment vers les 3/4 du film qui amorcent l'avancée des recherches, ça dure un peu trop longtemps. Mais la fin est complète, de l'émotion des larmes. Un gros chef d'oeuvre. "
5.0, Tout simplement magnifique Juste n en faisant pas trop On est pris dans l histoire du début à la fin A voir absolument 
3.5, Une belle histoire racontée de manière très classique et avec de très belles images. Malgré tout le film n'arrive pas à déclencher l'émotion. Peut-être parce qu'il veut justement trop en faire? 
4.0," Tout a été dit sur ce beau film qui relate une histoire vraie, et qui interpelle en fait sur deux sujets : la disparition d'enfants en Inde (80.000 par an !) et l'adoption avec ses conséquences. Sur le premier sujet, le film nous offre une vue à la fois belle et effrayante sur ce pays pauvre et quelque part mystique. L'ambiance du début du film est saisissante de réalisme à ce sujet et nous transporte dans un monde vraiment à part, avec ce petit garçon de 5 ans au regard si expressif (bravo au jeune acteur). La seconde partie traite de l'adoption par une famille australienne de Tasmanie de ce petit garçon perdu à Calcutta après avoir fait involontairement 1600 km en train. Devenu adulte, le jeune Indien est obsédé par l'idée de retrouver sa mère biologique et la retrouve grâce à ...Google Earth où il tombe un peu par hasard après des mois de recherche sur le village où il a grandi. Cette deuxième partie de film est traitée malheureusement avec beaucoup plus d'académisme, ce qui explique sans doute l'absence d'oscars. Néanmoins une très belle histoire, avec une excellente distribution. "
3.5," Le côté attendrissant des personnages au début du film nous plongent vite dans cette histoire rocambolesque mélangeant adoption/relation familiale parfois compliquée/la quête d'identitéc'est parfois sans dialogue, ça s'apprécie, c'est bien amené, bien raconté et le dénouement fait fondre.La chanson du générique de fin, belle trouvaille sur Sia (Never Give Up)! "
3.0," Cette histoire extraordinaire se perd un peu en cours de route, mais explose dans un final trop beau pour de vrai. Le choc des cultures et la première partie du film méritent le détour. "
4.0, Un début de film plutôt classique et pas très intéressant. La suite une fois adulte est vraiment mieux sans aucun doute. Dev Patel joue vraiment très bien. La mise en scène est parfois trop simpliste. La musique est très bien. Un film très touchant. Et une bonne idée sur la construction de l'identité. 
4.0," Reprise du cinéma après 2 semaines de vacances, je ne suis pas déçu du voyage.D'une part ce petit indien est trop mignon, mais passons.Le film confronte notre mode de vie moderne qu'on pense abusivement répandu, à la pauvreté et au malheur qui peut en découler de cette misère. Au délà de la seule misère, c'est le traffic d'enfants qui fait aussi froid dans le dos.On se rappelera alors la chance que l'on a de vivre dans un pays occidental avec des droits respectés et un niveau de vie qui nous confère plus que le confort requis dont une majorité dans le monde, finalement ne peut jouir. Un sentiment de culpabilité pourra se faire sentir, même si l'on ne choisit pas où l'on nait ni dans quelle famille ou plutôt dans quel niveau de vie.Ensuite, on voit aussi du positif, car on parle ici d'adoption, de ces associations qui aident et ces parents qui adoptent.Je dois avouer avoir versé ma larme, je ne vous dis pas quand. Ce film est touchant, plein de vie.Si vous voulez recharger les batteries en ondes positives, en humanisme, allez en salle ! "
5.0," Que dire de plus, si ce n'est que ce film est un pur chef d'œuvre!! Tout est absolument sublime et maitrisé : les plans, la mise en scène, le jeu des acteurs, la musique, l'histoire....Je n'avais jamais ressenti une telle émotion au cinéma ( et pleuré autant aussi!). Mais au delà de ça, ce film marque à jamais. Et aussi, ce film est d'utilité publique et a le mérite de bien nous faire relativiser nos problèmes ""d'occidentaux"". A voir impérativement!! "
4.5," Une épopée incroyable et inimaginable... et pourtant bien réelle. Film bouleversant servi par de grands acteurs : Dev Patel, Rooney Mara et Nicole Kidman, superbe. Mention spéciale aux enfants, excellents dans leurs rôles.Egalement de magnifiques paysages. "
5.0," Magique, solaire, triste, beau. Les adjectifs me manque. ça fait longtemps que je suis pas resté jusqu'à la fin du générique tellement ce film est bien. "
2.0," Mouais, je m’attendais à franchement mieux. L’intitulé « basé sur une histoire vraie » mis juste après le générique au moment où le film commence m’a mis la puce à l’oreille Lion va au fur et à mesure tomber dans toutes les facilités et pièges que pouvait receler cette histoire, à savoir faire un film tire larme avec des énormes sabots. Du coup au lieu de me toucher cela m’a de plus en plus agacé jusqu’au final qui en devient même ridicule. Il faut quand même féliciter Dev Patel et le jeune garçon qui joue Saroo petit qui sont tous les deux très justes et qui sont les seuls à apporter un peu de nuance dans un film au pathos pachydermique et où les larmes incessantes de Nicole Kidman m’ont fait penser aux rires enregistrés dans les sitcoms: si vous êtes trop bêtes pour savoir quand pleurer le film va vous dire quand. Il y a quelques belles scènes, surtout la première partie en Inde, mais franchement ça n’a rien d’exceptionnel. "
3.5," Un beau film sur une histoire vraie, jouant beaucoup plus sur les non-dits et le pouvoir des images que sur des dialogues qui resteront plutôt simples, voire absents. La première moitié du film est très subtile, même franchement dérangeante a posteriori (le passage sur l'orphelinat notamment); le passage à l'âge adulte (se faisant un peu trop vite quand même) déroule les interrogations avec beaucoup de finesse même si, avouons-le, la maîtrise formelle de l'ensemble compense la faiblesse des interactions entre les personnages (par exemple, la relation avec les parents adoptifs tient en deux scènes assez courtes). Les acteurs sont en tout cas très dans le ton, et la mise en scène fait son office pour distiller l'émotion. "
3.5," J'ai vraiment beaucoup apprécié, c'est une très belle histoire, très touchante et magnifiquement bien joué, après je trouve que tout au long du film, le réalisateur cherche à nous faire pleurer dans les chaumières, je me suis même dis que quelques scènes étaient un peu abusé mais dans l'ensemble c'est un bon film "
5.0," Un film extraordinaire avec des acteurs sublimes et une histoire bouleversante.Dav Patel, qui emprunte le rôle de Saroo, est sublime. A 25 ans, son besoin de connaître ses origines sera plus forte, et on le suit à travers ce film.Sunny Pawar, qui joue Saroo jeune, est attachant.Les acteurs, dans leur ensemble, sont surprenants !Cette histoire, d'un gamin qui est perdu à 1600 km de son village natal puis adopté par une famille australienne, est tirée d'une histoire vraie.Une émotion brute vous envahira et je vous invite à ne pas rater ce chef d'œuvre de Garth Davis. "
4.0," Ayant horreur des films tire-larmes cherchant à tout prix à émouvoir le spectateur par des artifices parfois grossier, j'ai été à ma grande surprise très touché par le film. Peut-être est-ce parce qu'il est tiré d'une histoire vraie; peut-être est-ce grâce à l'interprétation tout en finesse de l'ensemble du casting; peut-être est-ce la réalisation réussie qui sait montrer et dégager les émotions sans les arracher aux spectateurs. Ou peut-être est-ce tout cet ensemble qui fonctionne parfaitement ? Malgré des légères longueurs, au final peu gênantes, Lion est au final un très beau film qui parlera probablement à tous. "
5.0," 5 étoiles pour une histoire vrai qui touche une grosse problématique en inde et sa pauvreté... les acteurs sont top ! L'histoire est juste incroyable et on est porte dans le personnage, on est avec lui du début jusqu'à la fin! Les nominations sont logique bravo ! "
3.0," La première partie du film est une réussite. Le petit acteur est absolument craquant, adorable et l'histoire à ce moment là prend vraiment aux tripes. J'ai moins aimé la suite. La partie australienne tire en longueur et lorsqu'enfin il retourne en Inde, le film s'arrête. J'aurais aimé qu'on s'attarde un peu plus sur ce retour. Un déséquilibre quant au temps imparti aux 2 périodes décrites. Et puis, j'ai trouvé peu judicieux le choix de l'acteur adulte. Un géant alors que le petit acteur pour un enfant de son âge semble particulièrement menu et petit d'ailleurs l'acteur adulte dépassait de 3 têtes les gens de son village qui s'attroupent autours de lui. A moins que les Corn flakes et les hamburgers australiens aient changé son code génétique...! Et enfin, une mise en scène bien pauvre. "
3.5," Après autant de critiques spectateurs dithyrambiques, je plaçais donc mon niveau d'exigence plutôt haut: un début prometteur avec une rentrée impressionnante dans ce pays sous le regard de ce formidable petit indien, belle musique, belles images et rythme adapté. Puis la transition se fait avec notre petit héros devenu adulte, et malheureusement la deuxième partie avec sa vie en Australie et les trop fréquents flashbacks en Inde s'éternise et on en arrive à attendre la fin, qui vient enfin avec un générique présentant les vrais personnages, ce qui m'a fait un peu sortir de ma torpeur. Et puis non, je n'ai pas eu les larmes aux yeux, comme souvent dit ça et là, ainsi que dans l'introduction de la bande-annonce... "
5.0, Un film qui transmet tellement d'émotions... Tellement triste et tellement beau à la fois. Tiré d'une histoire vrai ça le rend encore plus magnifique. Un chef d'oeuvre... 
4.0," Lion n'a pas recu un superbe accueil de la presse et on lui reproche son coté mélo et son parti pris. Bien m'en a pris de ne pas lire les critiques de presse avant d'aller voir ce film. J''ai passé un magnifique moment, j'ai ete transporté en Inde. J'ai ete pris par les souffrances du petit Saroo. L'enfant acteur Sunny Pawar qui l'interprete est tout simplement merveilleux, au bout de 15 min j'avais deja ma petite larme à l'oeil et l'envie de le prendre contre moi ... Alors oui clairement c'est vrai que le film est lent, prévisible, larmoyant, ""qu'il brosse les spectateurs dans le sens du poil"" (je sais pas trop ce que cela veut dire d'ailleurs, admettons...) mais il n'empêche que j'ai ressenti pleins d' émotions et c'est tout ce que je demande à un film. Le film est beau ce qui ne gâche rien. Au dela du petit, la prestation de l'ensemble des acteurs est juste. On retrouve le Dev Patel de Slumdog Millionnaire. J'aime egalement beaucoup le jeu de Rooney Mara (croisé dans Millenium). Nicole Kidman, malgré ses 50 ans et sa chirurgie esthétique est également parfaite, meme si faudrait qu'elle pleure un peu moins... Ce film m'a peut etre autant touché car l'adoption me parle. Il réussit à nous en montrer egalement les difficultés et surtout il nous montre comme j'ai pu le lire fort justement dans une critique (comme quoi) ""que le bonheur passe avant tout par la quête de soi."" A VOIR ! "
4.0," Vraiment un très beau film, le fait de savoir que cette incroyable histoire est vraie ajoute de la stupéfaction.L'enfant de 5 ans est bluffant, il est fou qu'a cet âge là, certains puissent jouer de la sorte, c'est extrèmemment rare. A voir. "
4.5," Un film exceptionnel, le destin de cet enfant perdu.Certaines scènes sont très dures, quand Saroo est un petit garçon, mais c'est le lot hélas des enfants des rues en Inde.Sunny Pawar qui incarne Saroo enfant est formidable,très attachant.Dev Pavel, comme d'habitude est remarquable "
4.0," Ce film m'a tirée une larme. Touchant, émouvant, simple et triste. Je le recommande chaudement car c'est vraiment une belle histoire (triste?) "
5.0," Lion est un magnifique film, racontant l'histoire d'un petit garçon perdu en Inde, et adopté par la suite par un couple Australien...néanmoins, ses démons le rattrapent. Ce film est incroyablement touchant, plein d'humanité et de sincérité. Une très belle œuvre cinématographique ! "
5.0," Magnifique film, une superbe réalisation, des acteurs touchants. Ce film est une merveille, rempli d'émotions. À voir absolument "
3.5," Ce n’est pas du BolywoodSaroo est un gamin adopté, il a une famille en or et des parents aimants. Mais à l’âge adulte, une question se pose : où sont mon frère et ma mère.Perdu, à l’âge de 5 ans, dans une gare en Inde au milieu nulle part, Saroo est monté ans dans un train pour un voyage de plus de trois jours. Il a traversé le pays jusqu’à Calcutta mais d’où vient-il ?Adulte, il bascule dans l’obsession; abandonnant au passage une belle relation amoureuse et une vie sociale et professionnelle brillantes. Le petit gamin perdu de 5 ans s’est réveillé et veut retrouver ses racines avec l’aide de Google. Un casse tête quand on ne connaît ni le nom de son village, ni la région, ni son propre nom de famille.Mais la vie a su l’épargner et sa famille d’adoption australienne l’a choyé, ils n’ont pas eu la même chance avec Matosh le deuxième frère adopté, la vie l’avait déjà trop abimé. L’histoire de deux ans suspendus dans le temps pour les recherches de Saroo.Une histoire vraie, avec un regard sur l’inde et sa misère sans détour. A voir pour découvrir le pays où les grandes villes, comme des ogres, dévorent les enfants.Garth Davis soigne la réalisation, l’image est sublime mais le tout est un peu long, on finit par s’impatienter. Un film à voir malgré tout pour voyager sur une culture, un pays et des croyances qui nous dépassent. On traverse la ville et les odeurs nous envahissent.Garth Davis adulte est interprété par Dev Patel avec toute l’énergie de son désespoir.Nicole Kidman et David Wenham sont les adoptants avec bienveillance et amour.Mais Saroo « jeune » joué par Sunny Pawar, nous met KO par son naturel et ses grands yeux, où l’on plonge pour le plus beau des voyages.Adapté du livre de Saroo Brierley avec beaucoup de coeur et respect. "
4.0," Voilà une très belle histoire émouvante.Cela dit, j'ai préféré la première partie avec l'enfant.La deuxième partie quand le héros est adulte c'est plus ennuyeux.Mais quand il retrouve sa famille et l'endroit où il est né, c'est bouleversant. "
4.0," Un désir immense, chercher Ganesh Talai sur Google Earth une fois sortie de la salle. Prolonger l'instant. Une direction impeccable. L'immensité de l'inde. Des visages et des figures fortes. De Nicole Kidman à Rooney Mara. De Sunny Pawar à Dev Patel. La relation fraternelle avec Guddu et la responsabilité de chacun qui crée l'absence impardonnable. Des séquences exceptionnelles et un découpage irréprochable. On vit les rencontres, les abandons, les unions. "
5.0," Je suis encore scotché tellement ce film et cette histoire est touchante.C'est en Inde que tout commence avec le petit Saroo qui se perd en attendant le retour de son frère dans une gare et décide de se reposer un peu dans un wagon vide qui l'emmènera droit à Calcutta.S'en suit ensuite une errance qui s'arrêtera dans un orphelinat et par son adoption par un couple d'Australiens.Alors résumé ce film en deux phrases est juste impossible, pour ma part c'est un véritable chef d'oeuvre qui prend aux tripes de par sa réalisation enivrante avec des plans magnifiques.Le contraste entre la vie dans son village natal d'Inde et de celle en Australie est marquante comme si c'était deux univers différents et ça le film nous le fait bien ressentir.Mais la ou Lion réussi son plus gros tour de force c'est dans l'immersion, vivre cette histoire presque comme si c'était la notre!et la vertu du cinéma c'est bien ça, faire ressentir des émotions comme si c'était notre propre personne qui les avaient vécus ou même faire réfléchir le spectateur.Et c'est donc mission réussie, c'est fabuleux et émouvant et je conseille de le voir vivement.5/5 "
4.0," Tiré d'une histoire vraie (ce qui sublime encore plus le film), Lion parvient à nous émouvoir et à nous toucher au plus profond (en témoignent les nombreux bruits de larmes et de mouchoirs dans la salle !) : que ce soit par la simplicité et la force de résistance de ce jeune garçon livré à lui-même alors qu'il a tout juste 5 ans, ou la pugnacité et le désespoir de ce garçon devenu adulte alors qu'il se demande s'il va, un jour, retrouver sa famille indienne à laquelle il ne cesse de penser. Tout dans ce film n'est qu'espoir : espoir de s'en sortir, de s'accomplir et enfin, espoir de se retrouver...Lion est donc l'histoire de la quête d'un jeune homme, tiraillé par son passé et par les douloureux souvenirs d'une séparation brutale. Une quête à laquelle il faut s'empresser d'assister. "
3.5," Très beau film, certaines longueurs cependant, et moments trop ""faciles"" mais bonne réalisation dans l'ensemble, mention spéciale au petit garçon du film ""Saru"" "
3.5," Histoire vraie de ce héros, le personnage principal nous emporte à des époques différentes de sa vie.Nous voyons au départ Lion enfantet son périple. C'est beau et riche en émotions, nous sommes dans l'histoire de Saroo. La fiancée nous aide aussi à suivre et à saisir la ténacité que montre ce héros, les forces qui l'animent et sa détermination jusqu'au bout de ses rêves. Bel hommage et il nous montre combien le lien était solide et ancré en lui, en son inconscient, en son être et dans tout son personnage. La mère incarnée par Nicole Kidman, choix surprenant quand on sait qu'elle a joué dans des femmes si différentes comme celles de "" prête à tout"" ou "" les autres""...... "
5.0," Merveilleux ! Magnifique ! Splendide !Exceptionnel ! Très beau film, encore plus touchant quand ont sait que c'est une histoire vrai. Superbe. "
5.0," Il est magnifique, plein d'émotion !!! J'ai adoré !!!! Je n'ai rien d'autre à ajouter mise à part que ça n'explique pas assez ce que deviennent ces enfants qui disparaissent en Inde !!! "
5.0," Magnifique film, très intense en émotion. Le film met en perspective la quête de soi lorsqu'lon est un enfant adopté et une réalité dans un pays comme l'Inde: des dizaines de milliers d'enfants se perdent chaque année dans ce pays. Quelle performance des acteurs: Dev Patel est incroyable, Nicole Kidman méconnaissable et mention spéciale au petit qui incarne Saroo. La fin nous tire les larmes et encore plus lorsque l'on découvre spoiler:   les images des retrouvailles entre Saroo et sa famille , et ce avec la chanson de Sia.Excellent film "
4.0," Un film absolument bouleversant, peut-être d'ailleurs trop larmoyant, ce qui pourra en exaspérer certains (un peu plus de sobriété n'aurait pas fait de mal) mais il est difficile de rester insensible à cette histoire.La première partie nous montre les multiples visages de L'Inde : des paysages superbes, des villes étouffantes, une réalité sociale plus que difficile...la seconde partie est un peu plus décevante ( spoiler:  vive la pub pour Google Earth ), moins puissante et pourvue de quelques longueurs, à l'exception des 15 dernières minutes qui sont finalement assez attendues mais réussissent à prendre aux tripes. Les deux acteurs incarnant Saroo, Sunny Pawar et Dev Patel, font beaucoup dans la qualité du film, réussissant à rendre leur personnage attachant, pour lequel on tombe tout de suite en empathie. "
