Note,Commentaire
3.0," Comme c’est une histoire vraie, on ne peut qu’y adhérer, tout en s’étonnant de la manière dont le cinéaste nous la rapporte avec une évidence logique dans son évolution et la tardive révélation d’une terre qui appelle le héros depuis plus de vingt-cinq ans. Ça parait incroyable, mais le scénario a semble-t-il respecté la chronologie des faits. Pour en arriver là, Garth Davis saute fréquemment les étapes, et l’horloge du temps a alors parfois bien du mal à en saisir tous les événements. Ce qui bouscule l’ordre des choses dans une mise en scène parfois magistrale (la scène des cuillères, la rencontre du héros et de sa belle dans la rue.) parfois brouillonne et énigmatique à l’image de ce final qui n’en finit pas de se perdre sur Google Earth. Ça parait tantôt factice, tantôt réaliste, et les comédiens sont du même ressort, parfois crédible, parfois pas …Pour en savoir plus "
2.0," J'étais prête à adorer ce film. Je l'ai trouvé très figé et décousu. Loin de Slumdog millionnaire, ce film ne m'a pas prise aux tripes, il,est fade, parfois froid. Les 2 minutes de fin avec les vrais protagonistes franchement très émouvant, pour le reste il y a un manque d'âme et de profondeur qui frôlent la superficialité. "
2.0," Je vous présente le parfait tire-larme à Oscar, cuvée 2017. Une magnifique histoire servie par une réalisation maladroite et poussive, qui ne parvient jamais à sublimer le récit, ce qui en soit était plutôt prévisible. Sachons le, on vous a présenté cette épopée, vous en connaissez les tenants et aboutissants. Force est de constater que sa représentation filmographique n’apporte quasiment rien de plus. Pour moi un film qui fait voyager, avec de belles images, c'est déjà ça de pris. Et la photographie de Lion est un joli point fort. En attendant, Nicole Kidman possède la meilleure partie des dialogues avec le passage le plus fort en symboles, mais le reste demeure assez plat et attendu. Le film met l'accent sur une relation qui n'apporte rien si ce n'est pour pouvoir créditer Rooney Mara? Ça et la construction du film, entre autre, qui ne fonctionnent pas… Le nouveau Slumdog Millionnaire annonce l'affiche, vive les raccourcis, à ne surtout pas s'y méprendre. Qui ne peut pas être touché par ce genre d'histoire ? C'est bien d'ailleurs ce qui m'a le plus émue, les images d’archives…. "
3.0," LION évite les pièges du mélodrame pur jus, quitte à placer l’émotion à des endroits inattendus, notamment chez les personnages secondaires. Complexe, en dépit de son apparence hollywoodienne. "
4.5," Un fait divers incroyable raconté avec justesse et sensibilité, dans une mise en scène recherchée et une interprétation très réussie. "
4.0," Un chef d'œuvre d'émotions. Lion soulève les problèmes de la société par le biais de cette histoire de vie à la fois magnifique et bouleversante. Adoption, famille, surpopulation, inégalité, pauvreté : tels sont les thèmes du film qui les critiquent et les dénoncent.Le scénario, malgré de rares longueurs, reste très bien ficelé, sa forme est particulière. En effet, le film est séparé en deux parties : la première raconte comment Saroo se perd jusqu'à son adoption, la seconde raconte sa croisade pour retrouver sa famille. Les deux moitiés sont bien équilibrées, assez différentes dans la narration, on évite ainsi les potentielles longueurs qu'une histoire vraie comme celle la implique, en les réduisant jusqu'à ce qu'elles ne gênent pas le déroulement du film.Les mouvements de caméra s'adaptent parfaitement aux situations. Lors de la première partie, elle se met à la hauteur du jeune Saroo, les images mettent l'accent sur le point de vue du garçonnet. Les magnifiques paysages et vues du ciel sont impressionnants, les gros plans sur les personnages sont utiles du fait des performances des acteurs. Les prestations des acteurs sont époustouflantes. Dev Patel est très fort, il livre une performance mature, émouvante et fait un sans faute. Mais la médaille revient au petit Sunny Pawar. Je pense qu'il est interdit de remettre l'Oscar a un si jeune acteur, sinon il l'aurait sûrement remporté (à mon sens). Sa prestation est pure, il est génial, à seulement 8 ans il impressionne par son jeu d'acteur hors du commun. Il est sans aucun doute le prochain Dev Patel. Rooney Mara et Nicole Kidman sont très fortes également, à l'instar des autres acteurs interprétant des seconds rôles.La fin est magnifique, comme la façon dont elle est filmée, passant de l'adulte à l'enfant afin de les souder et de les présenter comme ne faisant qu'un. Un véritable frisson nous parcoure, la Vie et le chemin du jeune Saroo sont parfaitement clôturés. Le générique est également incroyable et nous achève complètement : on voit défiler les vraies images de cette histoire hors du commun, ca augmente l'authenticité du film, le tout couronné par la voix exceptionnelle de Sia dans le titre ""Never Give Up"". Fabuleux.Lion est un magnifique film sur l'identité, mais surtout la pauvreté y est dénoncée. On a honte de vivre comme on le fait alors que dans le même monde, des gens travaillent une journée entière pour deux sachets de lait, la misère humaine existe bel et bien et la film la dépeint telle qu'elle est. Triste, sans pour autant peser grâce à des pauses, Lion est très réussi, et ses acteurs sont époustouflants. Excellent film. "
2.0," Saroo, cinq ans, se perd dans un train qui l’emmène à des milliers de kilomètres de chez lui. Il se retrouve à Calcutta sans famille. Recueilli dans un orphelinat, il est adopté par une famille australienne. Vingt ans plus tard, il plonge dans ses souvenirs pour retrouver ses origines.D’après une histoire vraie. Mieux : d’après une incroyable histoire vraie promet l’affiche ! « Lion » (un titre plus approprié pour un documentaire animalier qu’une autobiographie d’un orphelin indien) est l’adaptation du livre de Saroo Brierley « A Long Way Home ». Il a séduit les Oscars qui l’ont six fois nominé et fait pleurer l’Amérique- je serais curieux de savoir l’accueil qu’a reçu ce film en Inde.Difficile de rester insensible au traumatisme d’un garçonnet perdu dans l’Inde immense et à sa joie de retrouver sa famille au terme d’une longue quête (non ! ce n’est pas un spoiler ! toutes les critiques l’évoquent !Le problème de « Lion » est qu’entre ces deux moments, il n’y a pas grand-chose à se mettre sous la dent. Rien que de très convenu dans la description de Calcutta, mégapole multimillionnaire filmée à hauteur d’enfant : des policiers violents qui chassent les gamins des rues, un pensionnat insalubre où l’on devine les obscurs trafics qui s’y trament à la nuit tombée.Un autre film commence quand Saroo arrive en Tasmanie dans sa famille d’accueil. Il a désormais les traits de Dev Patel, qui a la peau trop blanche et l’accent trop anglais pour incarner crédiblement le jeune orphelin monté en graine. On lui adjoint une fiancée, Rooney Maria, impeccable mais strictement décorative. Plus intéressant est le personnage de la mère adoptive qui donne deux scènes bouleversantes à Nicole Kidman. L’occasion pour elle de nous rappeler, malgré les ravages de la chirurgie esthétique, quelle grande actrice elle est. C’est le moment hélas où le film s’encalmine, les scénaristes ayant été incapable de donner de la vie à un personnage qui surfe sur Google Earth pour retrouver les paysages de son enfance.La scène finale arrachera évidemment des larmes à un crocodile. Elle flirte trop avec la téléréalité pour ne pas laisser un sentiment de malaise. "
4.5," Ce film est un chef d'oeuvre. De par la qualité des plans et des séquences, mais aussi de par les acteurs (aussi bien Dev Patel que l'enfant qui incarne Suru). De plus, ce film donne matière à réfléchir en terme d'adoption : on peut voir que certains parents adoptent simplement par bonté, malgré la difficulté que cela implique. "
4.0," Une belle histoire, bien filmée avec des acteurs efficaces. On suit avec plaisir ce personnage en quète de ses originesPLV : Le dépaysement est assuré "
4.0, Une très belle adaptation de cette histoire vraie. Une histoire de bravoure émouvante menée par des acteurs très profonds et qui véhiculent vraiment tout sans paroles. À voir! 
5.0," Un grand film, bouleversant .... une claque émotionnelle .... juste immanquable ... on en ressort bouleversé "
3.0," Film qui vaut pour cette histoire vraie emouvante car pour le reste , c'est correct mais pas transcendant , les acteurs sans plus et la realisation tres classique. "
3.5," Un bon film émouvant et prenant avec des musiques et une photographie réussie ! Les acteurs jouent aussi très bien. Bien ! 3,5/5 "
1.0," Par ce commencement de l'histoire par une tragédie indienne, la grande misère sociale couverte par une couverture immense dans cette réalisation sur son scénario qui se repose sur ses lauriers.Alors utilise beaucoup de boîte à mouchoirs pour faire fondre des larmes qui recouvrirait une rivière pathétique, le milieu se réchauffe, puisse être séché automatiquement amenant vers cette fin heureuse. Notre petit indien malheureux soit une intrigue à quiproquo connaît le fin mot de son histoire fraternelle, ce n'est pas Slumdog Millionaire qui veut, merci. "
4.0, LION : Larmoyant Impressionnant Original Notable !!!! LION est dans la même lignée que Slumdog Millionaire mais avec moins d'actions et plus d'émotions !! 
5.0," Poignant, émouvant... un être à la recherche de son passé. Le tout porté par une bande originale sublime "
2.0," Sans être vraiment mauvais, Lion est un long métrage qui m’a finalement bien plus agacé qu’autre chose. Ce qui m’a le plus dérangé est sans doute cette manière d’en rajouter à tous les niveaux autour d’une histoire qui, en elle-même, était suffisamment forte pour émouvoir et méritait plutôt un traitement sobre pour gagner en efficacité. Il y avait pourtant tout, ce qui est peut-être le plus frustrant, d’ailleurs… "
4.0," Cette histoire vraie est bien émouvante et le film est bien réalisé.Je mets 4 étoiles et pas 5 car il y a des longueurs et quand le héros est un homme, les scènes se traînent en longueur et l'ambiance est trop morne, triste. "
3.0," Droit au coeur, cette aventure d'un jeune aventurier des temps modernes. Histoire romanesque, incontestablement, mais cinématographiquement, pas sur. En tout cas, pas sous cet angle. On en connais la fin d'avance et les recherches sont survolées par un simple clic. C'est un peu gros. L'émotion est arrachée comme un voleur sur la fin, mais en vaut-elle vraiment la peine ? J'y vois deux autres films : comment une mère, dans une détresse infini, cherche ses enfants dans un océan d'humain ? Ou alors, comment élevé de front, deux enfants adoptés, aux antipodes, sensés émerveiller une vie, mais qui se retrouvent à faire souffrir leur mère protectrice ? Ce n'est pas le partie pris de Garth Davis, qui choisit une certaine facilité scénaristique, et c'est bien dommage. "
3.5, Une belle et émouvante histoire très bien restituée par la réalisation et les interprètes de ce film.  
4.5, Beau film. Mérite son oscar. Belle réalisation . Émouvant et touchant du fait que ce soit une histoire vraie. Je recommande et en Vo c 'est toujours mieux....😉 
2.5," Biopic beaucoup trop linèaire et ultra prévisible. La réalisation est très plate, sans aucune inspiration, malgré une image léchée. C'est ultra consensuel et l'émotion lorgne beaucoup vers la télé-réalité. Le film est plutôt bien quand notre héros est un gamin, quand il grandit, c'est la grosse déception. "
2.0, Cinématographiquement parlant le film n'a pas un énorme intérêt. Bon il y a l'histoire qui sort de l'ordinaire et le film pose quelques questions. A mon avis un reportage pouvait faire aussi bien l'affaire mais bien sûr c'était moins glamour. 
1.0," Ce faux ""Slumdog millionnaire"" vise à faire pleurer les foules, avec de gros sabots : musique romantique quand c'est émouvant, regards éperdus, etc. Nicole Kidman est enlaidie, véritable exploit technique. Seul le héros enfant est réellement bouleversant. À regarder si on a épuisé son stock de films de baston. "
4.5," Les premiers papiers faisaient référence à ""Slumdog millionnaire"" ???Excepté l'acteur principal, il n'y a rien de commun entre ce film et celui précédemment cité.Je fais court, la première heure campe les personnages, la demi_heure suivante, tout le monde pleure dans ma salle de cinéma...Conseillé "
5.0," Quel film ! Difficile de trouver les mots pour décrire toutes les émotions, tout d'abord parce que ce n'est pas une fiction, mais une histoire vraie et quelle histoire ! On se prend tout de suite d'affection pour ce petit garçon de 5 ans qui vit en Inde dans une famille très pauvre mais pleine d'amour. Le destin lui joue un sale tour lorsqu'il se retrouve enfermé dans un train vide qui le conduit à Calcutta a des centaines de KM de chez lui. Il se retrouve livré à lui même dans cette megapole grouillante, dans l'indifférence la plus totale. Il y a tant de misère que les gens y sont habitués, c'est leur quotidien, chacun doit se battre pour survivre et c'est bien souvent chacun pour soi. Il n'y a plus de place pour les sentiments, la pitié ou la compassion. Beaucoup perdent leur humanité et utilisent ces enfants comme moyen pour gagner de l'argent en les réduisant a la mendicité, la prostitution... Notre petit héro arrive à survivre dans ce chaos jusqu'au moment où ilse retrouve dans un orphelinat puis est adopté par un merveilleux couple d'australiens. Il garde en mémoire des souvenirs extrêmement précis de ces 5 premières années de vie en Inde et souhaite retrouver sa famille biologique... C'est une belle leçon de vie, d'amour qui prouve que la vie peut-être cruelle mais aussi merveilleuse, que le plus sordide cotoie le plus beau qu'en un rien de temps la vie peut basculer dans le pire comme dans le meilleur. J'avoue que j'ai pleuré en visionnant ce film, et c'est une chose qui m'arrive rarement, mais là j'ai été touchée en plein coeur. C'est une belle histoire qui méritait d'être connue. Et Dev Pate est, comme toujours grandiose, tout comme le petit garçon qui joue le rôle du héro enfant, ils ont su me toucher en plein choeur tant c'est criant de vérité. Je n'ai qu'un conseil : ne manquez pas ce film, c'est un veritable bijou. "
1.5," Larmoyant, sensible et touchant, mais au final peu intéressant, lent, et souffrant d'un manque d'originalité accrue. Très moyen, sans être catastrophique car quelques bonnes choses, mais globalement pas terrible. "
1.0," Comment dire ! L'histoire de ce garçon est riche d'idée .... Mais pour cela il faut du talent !Plein de bon sentiments de grosse ficelles, aucune finesse, aucun parti pris....Les comédiens font de leurs mieux ....même Nicole Kidmann si si .....mais sans direction d'acteurs....ça va pas loin!Une mention spéciale pour le comédien du jeune Saroo il est lumineux et très authentique !C'est long et sans intérêt !Ca demarre par c'est une histoire vraie et ça se termine par la preuve voici les vrais gens!La vacuité de ce cinéma là racoleur et vide de sens! "
4.0," Avons-nous plusieurs vies ? La question ne se pose pas au sens propre mais pourrait l'être au sens figuré. Il est intéressant de voir à quel point une seule vie peut comporter une multitude d'expériences, aussi petites soient-elles, aussi intenses soient-elles. Alors, nous ne sommes heureusement pas arrivés au point de nous morfondre dans des phrases toutes faites comme ""Nous n'avons qu'une seule vie"" ou ""La vie est trop courte donc il ne faut pas la gâcher"". Loin de là, lorsque l'on se pose ce genre de question, il faut voir au-delà du simple sens des mots et parvenir au sens des actes. C'est là tout l'intérêt de *Lion*: Garth Davis ne nous fait pas la morale, il conte l'histoire extraordinaire et vraie de son protagoniste. Et pour lui, la vie d'un individu au sens propre n'est tout simplement que l'addition de toutes les vies qu'il peut avoir au sens figuré. La puissance du film ne réside pas seulement dans ce qu'il nous montre, mais également dans ce qu'il raconte.Le scénario du film puise sa trame principale dans le livre *A Long Way Home* écrit par Larry Buttrose et surtout par Saroo Brierley, qui n'est autre que cet indien qui s'est perdu à 5 ans, se retrouvant malgré-lui à Calcutta, très loin de son frère et sa mère. Recueilli dans un orphelinat, il est adopté par une famille australienne et commence alors une nouvelle vie. On retrouve le personnage principal 20 ans plus tard sous les traits de Dev Patel, alors étudiant, qui va entamer des recherches pour retrouver sa famille de naissance. L'on pouvait craindre un certain déséquilibre dans le film entre la partie indienne et la partie australienne. Que nenni ! Garth Davis et son scénariste, Luke Davis, nommé (justement) aux Oscars, ont parfaitement su gérer ces deux parties, n'oubliant pas d'apporter un regard cinglant sur cette Inde des années 1980 qui fourmille, impatiente d'émerger, mais qui est frappée par une pauvreté et des inégalités criantes. Davis prend d'ailleurs le temps de poser sa caméra sur cette jeunesse victime de la misère et sous-développée et sous-éduquée, problème majeur en Inde et qui l'est toujours d'ailleurs. Le réalisateur n'a pas oublié l'Inde, à l'instar de Danny Boyle et son chef-d'oeuvre *Slumdog Millionaire* il y a presque neuf ans. Ce pays n'a pas servi de prétexte mais a été utilisé à bon escient, un décor, une prison pour les personnages. L'éducation n'est pas cette évasion pour les jeunes, au final, pour les 80 000 enfants indiens orphelins, l'évasion est l'adoption, à condition de ne pas être adopté par n'importe qui. Saroo a donc eu cette chance de tomber sur une bonne famille. Mais même lorsque celui-ci se trouve à quelques milliers de kilomètres, l'on ne renie jamais son passé, on n'oublie pas un passé, surtout lorsqu'il fut âpre et compliqué. L'émotion que veut apporter Davis est transmise à travers un montage efficace qui s'efface pour finalement traduire non seulement des souvenirs mais également la blessure, celle d'une vie que l'on croit gâchée parce qu'éloigné de celle qui nous a mis au monde. Une adoption peut certes changer une vie, mais elle ne remplace pas une vie: c'est une rupture brutale mais non finale. Et le Saroo que l'on retrouve étudiant se retrouve partagé entre deux mères et entre deux frères, Guddu, qu'il a perdu vingt ans auparavant, et Mantosh, lui aussi adopté. C'est un moment difficile de sa vie, celui où il croit qu'il a un choix à faire entre remuer les êtres du passé et ceux du présent, il pense que les uns ne peuvent aller avec les autres, qu'ils sont incompatibles. Étrangement, alors qu'il recherche les uns, il est en train de perdre les autres. *Lion* ne tombe pas dans le piège du paradoxe, il le magnifie. Et c'est ce qui rend à ce film sa beauté, une beauté pas seulement offerte par une histoire bouleversante, mais aussi par un visuel soigné, sincère, qui offre des scènes d'une remarquable portée, due à une photographie travaillée et récompensée elle-aussi par une nomination aux Oscars. Celle-ci s'appuie sur les contrastes entre une Inde mortifère et poussiéreuse, dont la couleur orange, appuyée et appliquée sur plusieurs tons, représente cette terre encore sauvage et laissée telle quelle, non goudronnée mais qui appelle à l'être, et une Australie développée qui se dévoile sous des couleurs plutôt neutres, unies. Greg Fraser joue parfaitement sur cette différence de couleur pour obtenir une vraie rupture entre les scènes indiennes et australiennes, coupées par un sublime montage. Mais le film ne saurait être identique sans son casting. Trois acteurs se démarquent indéniablement: Dev Patel, le protagoniste, Nicole Kidman, la mère adoptive (les deux nommés aux Oscars dans la catégorie second rôle), et Rooney Mara, la petite-amie de Saroo. Ils portent à eux trois l'ambition d'un casting et de la mise en scène de personnages au destin extraordinaire. L'interprétation sans faille et sans surplus, simple de naturelle, des acteurs apporte cette touche ultime de sincérité qu'essayait déjà d'introduire la patte de Garth Davis. Le film est grand, et pourtant tout y est discret, rien n'est grandiloquent, rien ne se croit au-dessus de ce que le film est ni de ce que le film raconte. Et cette discrétion se retrouve dans la course aux Oscars. Alors que *La La Land* ou encore *Moonlight* trustent les têtes d'affiche, *Lion* poursuit son cours, avance sereinement. On ne peut pas encore dire s'il est sous-estimé, il a tout de même récolté six nominations dont celle de meilleur film auprès de l'Academy ainsi que de nombreuses récompenses depuis sa première à Toronto en septembre. On espère juste qu'il ne sera pas oublié et qu'il ne passera pas inaperçu car il est à la hauteur de son sujet et de son ambition et offre un récit brillant méritant d'être conté. Pour son premier film, Garth Davis frappe un grand coup et réalise une entrée fracassante dans le monde du cinéma. Authentique à la réalisation de *Lion*, il a su porter à l'écran le destin fantastique de Saroo Brierley. Très compétent dans sa direction d'acteurs, il a également été entouré d'une équipe technique performante pour créer un film parmi les meilleurs du cru 2016, année décidément incroyablement productive qualitativement. La musique qui accompagne les presque deux heures du film ne résonne pas creux, bien au contraire, c'est la cerise qui vient se poser délicatement sur le gros gâteau que représente *Lion*. Les Weinstein ont eu le nez creux pour produire ce film au résultat brillant. Est-ce une surprise ? Difficile à dire car la qualité était annoncée mais jamais nous n'aurions pu imaginer une telle puissance dans l'émotion. Même s'il passe inaperçu en France, le film laissera une trace certaine chez ceux qui l'auront vu. "
5.0, Très bonne surprise pour se film adapté d'une histoire vrai. beaucoup d'émotion et une fin surprenante. 
5.0, c'est très émouvant mais non larmoyant. une vraie quête de vérité et de retour au source qui nous plonge dans un recul sur notre vie d'occidentaux. ce film m'a profondément ému et interpellé. j'irai le revoir avant qu'il ne sortirais en salle ! 
5.0," Je trouve que c'est une très belle histoire, et je je trouve quand il était petit il était très intelligent (il comprenai à qui il avait à faire) "
5.0, bravo au réalisateur du film !!!! avec beaucoup d'émotion enfin un vrai film 🙂 de loin le meilleur que j'ai jamais vu ... allez le voir de toute urgence je le conseille vivement 
5.0," Ce film mérite bien plus que des oscars, une histoire magnifique. Une histoire extrêment très triste, vraiement j'ai pas de mot voyez le "
2.0," Bon bon bon ... Je vais encore passer pour le rabat-joie de service mais je ne comprends absolument pas l'engouement pour ce film qui est à mon sens l'exemple typique du métrage censé être bouleversant mais complétement bouffé par son puissant scénario. L'ensemble est très surfait, de plus tout y est pour faire pleurer dans les chaumières, c'est tellement tire-larme que ça en devient presque ridicule parfois. Je suis en outre complétement passé au travers de la première partie, trop longue et peu émouvante malgré la bonne bouille du gamin qui se trouve être certainement le meilleur acteur de ce film. Dev Patel, sans être mauvais, n'est pas exceptionnel, Rooney Mara ne sert à rien, pas aidée par une histoire d'amour très mal amenée et assez improbable et Nicole Kidman pleure sans cesse même si son visage ne laisse plus passer aucune émotion. Les décors sont très beaux mais je ne suis entré dedans et le piano qui ne cesse jamais n'aura pas suffit à m'émouvoir, l'ensemble étant bien trop facile et trop mou à mon goût. On ne s'épanchera pas sur le manichéisme du bon fils et du mauvais ainsi que sur les thèmes principaux tel la recherche identitaire et des racines complétement survolés. Reste le final, qui lui au moins respire la sincérité et s'avère touchant, contrairement au métrage en lui-même, formaté pour les récompenses et peu enthousiasmant. Une déception en somme. "
4.5," Excellent moment passé en regardant ce filmTouchant et émouvant à souhait, Avec un Dev Patel et une Nicole Kidman qui interprètent magnifiquement leur rôle.A voir absolument! "
3.5," le film est une réussite , est aussi une jolie histoire . franchement j'ai été touché par l'histoire . avec c'est acteurs qui joue a merveille . "
