Note,Commentaire
4.0," L'adaptation d 'une histoire vraie aussi incroyable n'est pas aisée. Les deux acteurs qui interprètent Saroo, l'enfant en Inde puis l'adulte adopté en Australie, jouent leur rôle avec conviction. Le petit Saroo est remarquable, criant de vérité.Il y a trois parties dans ce film: la première, c'est la vie du petit Saroo en Inde et le récit de ses aventures après qu'il a perdu son frère, sa ville et tout moyen d'y revenir. C'est la meilleure à mon sens. La deuxième est le récit de l'adoption, et c'est la moins intéressante. Les conflits entre le Saroo et son frère perturbé, adopté lui aussi, entre ce dernier et les parents, les interrogations inévitables et la quête des origines des enfants adoptés ne sont pas convaincantes. C'est assez décousu et ennuyeux.La troisième concerne les efforts de Saroo adulte pour retrouver sa famille via Google et son voyage en Inde pour revoir les siens. Les retrouvailles sont émouvantes, le spectateur éprouve de l'empathie pour cette famille si pauvre et courageuse que la vie a cabossé.Une belle histoire, avec tout de même l'impression de voir un conte de fées. Les interrogations gênantes sont évitées: l'adoption d'enfants étrangers pauvres par des familles occidentales les coupant de leurs racines,par exemple, pose pas mal de questions. "
4.0," Émouvant. On retient ses larmes , on a la gorge nouée .Très belle interprétation du très jeune acteur indien Sunny Pawar . Et Dev Patel donne tout son émotion dans ce film dont le projet lui tenait à cœur surement.Bravo "
4.0," Beau filmCe film nous prend dès le début, et nous relâche qu'une fois le film fini.Très bon acteur. "
4.0," J'ai adoré ! même si j'ai aussi beaucoup pleuré. on suit le cours des événements comme si on était le petit garçon, c'est à dire en se laissant porter, sans trop comprendre qui sont ces étrangers, quelles sont leurs intentions, où sommes nous, que faire au milieu de cette fourmilière qu'est Calcutta? on en a le vertigepoignant, esthétique, et VRAIE histoire ! "
2.0, trop lent.la sauce ne prends pas vraiment.les acteurs sont très bon. le gamin particulièrement. mais le sujet n'es que survolé.dommage... 
3.5," La première partie est très prenante, avec un petit acteur bouleversant. La suite, hormis la prestation de Kidman, a elle un peu moins de relief. La fin est belle à pleurer. "
4.0," Un film simple dans son scénario de conte de fée finalement très linéaire et pourtant tellement prenant et émouvant. Le contraste entre l'Inde et la Tasmanie, le village indien, la ville de Calcutta et la pensée occidentale qui veut le bien de l'humanité contribue à nous plonger dans une sorte de road movie culturel ! Enfin les travelling, les vues ariennes et les vues steady cam renforcent l'impression de voyage...une belle réussite! "
5.0, voilà un chef d'oeuvre qui m'a fait fondre en larmes. histoire qui m'a scotché tout le long jusqu'à la scène finale ou tout est révélé. a voir impérativement dans sa vie. magistral 
3.5," J'ai beaucoup aimé la première heure du film, sur le chemin parcouru du jeune acteur qui est très attachant. En revanche, je n'ai pas apprécié la seconde partie, adulte, à la sauce Hollywoodienne  spoiler:  histoire d'amour avec une belle actrice occidental pour faire bien  et qui est creuse où il ne se passe rien.En revanche, la fin  spoiler:  avec le parallèle de la réalité  est très touchante. Dans ce genre là, j'ai préféré Slumdog millionnaire pourtant moins bien noté. "
4.0," Pour une fois les critiques cinéma se plantent ! Lion est un film subtil qui à travers le jeune Saroo raconte aussi l'histoire des enfants indiens. De longues minutes de silence où l'image prend tout l'écran parce qu'il n'y a pas plus à ajouter aux superbes visages, paysages de l'Inde. J'ai beaucoup apprécié cette histoire et la façon dont elle est mise en scène à l'écran. Pas de pathos mais la vie tout simplement. Si les critiques cinéma sont si sévères (pour moi) à l'égard de Lion c'est peut-être aussi parce que ces gens s'éloignent de la réalité et des attentes du public. C'est ça aussi le cinéma : l'émotion et la vie. "
4.5," Le film est fort bien fait. Les acteurs jouent avec sincérité. Pas d’effets spéciaux, ni de « bricolage » comme on en voit très, trop souvent de nos jours…Les scènes tournées en Inde sont criantes de Vérité. Ce pays si pauvre dans les campagnes, terrain où l’entraide et l’Amour sont au quotidien. Entre les deux périodes (l’enfance de Saaro et l’époque où il devenu adulte), l’Inde profonde, celle des campagnes reculées n’a pas changé.L’évocation de l’adoption par Amour nous donne une belle leçon de sagesse. Adopter simplement par Humanité, pour aider des enfants et pas simplement par le fait que l’on ne puisse en avoir naturellement…Ce film sera, je l’espère, récompensé. "
4.5," Un magnifique poignant film, dont nous sommes tous sortis emplis d'émotions. Le thème des enfants délaissés et abandonnés en Inde est bien soulevé à travers l'histoire de ce petit.La symbolique de l'adoption et de ces retombées sont traitées de manière claires, particulièrement fortes et émouvantes... "
4.5, Un film touchant. Une belle réalisation tirée dune histoire vraie. Ainsi qu'une jolie bande son durant tout le film. 
4.0," Le scénario serait improbable s'il n'était pas inspiré d'une histoire vraie. On suit Saroo à 5 ans en Inde puis 25 ans plus tard en Australie à la recherche de son passé. A la fois courageux, égoïste et déterminé, il crève l'écran. Très émouvant, le film est réussi. "
3.5," J'ai voulu le voir suite à la bande annonce sur Canal . J'ai été agréablement surprise, d'autant plus que ca finit avec les vraies images des personnages. Histoire émouvante. "
3.0," Aventures en train inconnu.L’Inde, pays de contrastes, terre des richissimes maharajas cohabitant avec une quart-mondesque cour des miracles. Cette partie de l'orient extrême dans son abyssal écart de classe ou des bidonvilles croupissent aux pieds de luxurieux palais, son économie roucoulant à la sixième place mondiale avec des records d’analphabétisme et de taux de mortalité… Le cinéma n’échappe pas à cette culture du paradoxe avec la plus grosse machine au monde à débiter de la pellicule colorée la ou la misère n’a rarement été aussi noirâtre. Une industrie trop prolifique et trop bigger-than-life, un glamour trop cheap, une pauvreté trop freaks… autant de (probables) bonnes raisons pour ne pas attirer les réalisateurs étasuniens, ceux de l’autre grand pays du cinéma. Ce dernier constat tient dans un petit chiffre : en 30 ans seulement 3 films ont eu comme décorum l’inde coté ""coulisses"". « La cité de la joie » (1992), premier tome d’un triptyque aux parfums frelatés, ne rechigne sur aucun cliché, et malgré une reconstitution de carton pâte assez réaliste, les « méchants » ont plus les allures des maffieux de Chicago que de véritables terreurs locales. Une intrigue marshmallow due en grande partie à son inévitable accent hollywoodien avec un Patrick Swayze trop hygiénique, des ressorts dramatiques cousus de fils blancs, une mise en scène trop blockbusterisée pour être vraie et un manichéisme affligeant . Seule l’interprétation de Om Puri, le tireur de pousse-pousse, est assez bouleversante de vérité et de dignité. C’est d’ailleurs de ce coté la que se situe une (la ?) des réussites de « Slumdog Millionaire »(2008) avec Dev Patel dans le rôle de Jamal, ce jeune Hindou qui participe a «Qui veut gagner des millions ?» confortablement assis dans sa peau de « pauvre orphelin » et a la destiné marquée par une déshérence qui frôlerait presque la caricature si le film de Danny Boyle n’était pas emporté par une débauche d’énergie prompte a emporter les plus réticents. Une générosité, renforcée par celle du réalisateur, qui suffira malgré un scénario abracadabrantesque a forcer notre indulgence et nous empêchera de bouder notre plaisir. Pour trouver trace d’un naturalisme beaucoup plus documentarisé il faudra attendre 2016 et ce « Lion » ou la misère locale n’a jamais paru aussi poisseuse et surtout aussi réaliste. La faute à une sublime photographie qui sublime la crasse et transcende la saleté. L’errance du petit Saroo perdu dans l’immensité de cette région est rendue tellement anxiogène qu’il est impossible de ne pas être submergé par l’émotion. Surtout que la bande son aussi lyrique que grave rajoute artificiellement une part supplémentaire de dramaturgie. A voir le jeu de Sunny Pawar, étranglant de sincérité, on en vient a penser que l’interprétation « locale » est un gimmick récurrent puisqu’elle surfe sur celle du tireur de pousse-pousse et du néo millionnaire, avec une déconcertante empathie. Si le coté « histoire vraie » n’était pas forcément obligatoire pour accroire l’émotion il ne la dessert pas. A part d’être frappé d’une pathologique insensibilité affective, il est quasiment impossible de ne pas sortir la boite a kleenex… a tel point que l’on pourrait en perdre son libre arbitre, emporté par ce torrent de larme qui peut faire déjuger. Car la deuxième partie du film sonne assez faux pour ne pas finir pas se rendre compte du subterfuge dans lequel le réalisateur nous a fait tomber. « Lion » est trop pathos et trop lacrymal pour être « vrai », et le passage a l’age adulte de Saroo nous désembue les yeux pendant que, justement, les siens s’inondent au fur et a mesure ou l’enjeu principal du thème se met en place, a savoir retrouver sa mère et son frère depuis son Australie d’adoption grâce a Google earth …Si Nicole Kidman en mère adoptive très « femme de son age » (précision importante car elle a passé le reste de sa filmo a jouer les éternelles « jeunes ») est crédible, son rôle est rendu subsidiaire par des dialogues et une présence qui tiennent sur un post-it . Globalement cette partie du métrage s’étire en longueur et sent le remplissage (que dire du frère adopté, complètement inutile !) tant les ressorts du passage a l’age adulte et le choc des cultures sont balayés, autant que le développement personnel de notre slumdog Dev Patel, qui a du mal a se dépêtre de son rôle mono expressif du film de Boyle et nous sert de la larmette a tour de cils.Des pleurs enrichis par une musique très « Intouchable » qui, a force d’appuyer sur ce truchement technique ressemblerait presque a des cartons en sous titres ou il serait marqué « Pleurez » !Bref une grosse moitié du métrage qui se plante généreusement et que le « happy end » final ne rattrapera pas, le mal étant fait depuis que la boite a mouchoir s’est vidée. « Lion » est ce que Garth Davis voulait en faire : un joli film sur une belle histoire, et le « truc » fonctionne. Mais sa technique est aussi paresseuse que les publicitaires pouvaient se montrer racoleurs en le vendant comme “le nouveau ""Slumdog Millionaire�, sous couvert de la présence du même acteur. Mais on est loin de l’énergie folle du premier nommé, dont la seule comparaison suffit d’ailleurs à faire de ce fait divers une adaptation lénifiante.Dommage, car on l’aimait bien, ce gamin… "
5.0," Je ne crois pas avoir les talents critiques pour ajouter quoique ce soit à la beauté de ce film, mais je dois dire qu'il m'a franchement émue. Même 5 jours plus tard, je m'en remets à peine, d'autant plus que c'est tiré d'une histoire vraie. La première partie du film qui se passe en Inde et portée par le jeune Sunny Pawar est tout simplement magnifique et tragique. Elle n'est pas sans rappeler la jeunesse de Jamal dans Slumdog Millionnaire, un autre chef d’œuvre. La seconde partie avec Dev Patel, si elle n'est pas tout à fait à la hauteur, se rattrape par un final époustouflant, doux et amer, qui est ensuite sublimé par des images réelles. Je vous conseille de le voir jusqu'au bout des crédits pour ne pas manquer la belle dédicace. spoiler:  Guddu... Guddu.... ah je ne m'en remets pas du tout...  "
5.0," Superbe, émouvant.... une bonne partie de ce film se déroule pendant l'enfance, on y voit donc très bien retranscrit, la vie d'un petit indien face à la violence du monde. (le jeune acteur est sublime)... donne à réfléchir, très bien filmé... A voir absolument. "
5.0," Ma femme m'a vu pleuré une fois en 6 ans à l'occasion de la naissance de notre fils, et ben avec ce film ça fait deux fois ! incroyable, émouvant au possible, ça ferait pleurer une pierre... Sinon le film est excellent, les détails, les décors, les personnages, il n'y a aucun défaut... Fantastique film. "
4.5, Très beau film. Magistralement interprété. Un excellent mélo sur la quête de ses origines. A conseiller sans modération... 
5.0," Un film émouvant du début à la fin. On ne s'ennuie pas et on s'attache au petit garçon qui devient grand, on tremble pour ce qui pourrait lui arriver. Un sujet traité avec dignité. Allez y ! "
2.5," J'en attendais certainement trop dû a l'engouement autour de ce film, le film commence pourtant bien, un casting au top pour la 1ère partie ( Saroo et Guddu enfants), c'est touchant, les musiques, les paysages, je me dis que ce film, je vais l'aimer.. Décollage pour l'Australie..et la c'est le crash!! du film pas de l'avion ;) J'ai totalement décroché, j'ai l'impression d'avoir assisté à une pub pour Google Earth pendant 45 min, c'est a peu près tout ce que j'ai retenu, on passe à un casting 5 étoiles qui n'apporte quasiment rien ( pas du tout aidé par la seconde partie  que poussive il faut le dire) , je suis totalement sorti du film pour ne revoir la lumière qu'au moment d'émouvantes retrouvailles, Alors oui le sujet du film est fort, mais au delà de l'émotion que peut procurer ce film, il ne faudrait pas oublier de se faire un avis objectif sur celui-ci, et pour moi c'est une déception. "
4.5," Belle hommage à cette histoire vrai si bien mise scène. On oubli le film, les acteurs tellement les paysages nous emporte ! On a beau essayé de retenir nos larmes.. Nos tripes sont compressées tellement l'émotion est forte et les personnages si attachant. Bravo aux acteurs ! ! "
4.5," Un film autant incroyable qu'émouvant. Lion vous plonge dans la vie d'un enfant qui se perd dans l'immense pays qu'est l'Inde et qui va mener une lutte acharnée pour tenter de retrouver sa famille.Non seulement l'histoire est très prenante mais la qualité cinématographique, audio et les images sont merveilleuses.Un film qui nous remet un peu à notre place dans notre confort de la vie européenne quotidienne.Fin bref,un film que je conseille fortement d'aller voir. "
3.5, J'ai enfin vu ce film qui a fait tant parler... Je ne sais pas si je suis la seule mais j'ai été décidé... Je m'attendais a être submergée par les émotions... Et bien non... Qualeques longueurs à déplorer... Cependant l'histoire est exceptionnelle... Je recommande ! 
4.5, Ce film est juste magnifique !L'histoire est vraiment belle et la mise en scène aussi.Je le conseille vivement. 
5.0, Un film magique qui pose une belle reflexion sur l'adoption! bain culturel et personnages à fleur de peau pour cette histoire vrai racontée avec beaucoup d'émotions! 
4.0," Une belle idée de départ, mais le film montre une chose : un régal pour les yeux tant que l'on est en inde et un ennui total avec la vie en australie. Est ce fait expres ? "
5.0, Une histoire incroyable avec une première partie intense en émotions. De jeunes acteurs qui font oublier que c'est un film.un début de seconde partie avec quelques longueurs qui ce fait vite évincé par une fin incroyable et magique. un film qui fait du bien 
5.0," magnifique ! un jeu d'acteur impressionnant de justesse, de sincérité et de naturel, une fin d'histoire très emouvante : un film qui touche par sa dure et malheureuse réalité... "
0.5," tire larme sans intérêt cinématographique, gauchisme pompeux. la réalisation est bâclée, le scénario est indigeste, je m'en vais vomir sans plus attendre. "
5.0, Magnifique film qui ferait pleurer une pierre ... Ca faisait longtemps que je n'avais pas vu un si beau film.. Une histoire vrai bouleversante.... Superbe. 
4.0," Franchement je m'attendais à rien et je me suis retrouvé à chialer comme une madeleine devant ce film, grand respect et merci pour l'émotion "
5.0," Un film à voir absolument. Un destin, une vie....amour et émotion. Seule la vie pouvait imaginer cette aventure "
4.5," Le film est très très bien en soit. Je reproche juste de ne pas montrer les réalités de l'Inde explicitement, à savoir, le trafic d'enfants, le manque d'aide aux pauvres, la réalité de la vie des enfants des rues (drogues). Par ailleurs, le temps consacré à rechercher sa vraie famille est beaucoup trop long. Pour ma part, je me suis un peu ennuyé à ce moment là. Sinon le film montre bien la pauvreté en Inde. "
4.5," film touchant jouer merveilleusement bien Nicole Kidman ça vous touche vraiment , époustouflant ce film m'a beaucoup émue !!!!! "
5.0," un chef d'oeuvre qui mérite largement ses récompenses. Très belle réalisation, très belle histoire, très bien joué, et quelle emotion "
5.0," Un film magnifique, qui prend au tripes, quoi dire de plus sinon de le regarder!!! Sans hésiter un magnifique film émouvant simple, sincère qui mène à réflexion!! "
4.0," Histoire vraie qui rend le film encore plus intéressant. L'acteur de ""Slumdog millionnaire"" est toujours aussi émouvant. N.Kidman transmet sa joie et ses douleurs aussi. Les deux adoptions d'enfants donnent des satisfactions et des déceptions tellement différentes. Difficile de retenir une larme lors de certaines scènes. Un bon long métrage. "
5.0," Incroyable histoire et un film magnifique, très émouvant et très bien joué, j'adoré. Un des grands films de cette année ❤️ "
3.0," Il faut préciser avant tout que je n'ai pas lu le livre dont est tiré le film, je me fie donc uniquement au film de garth davis pour juger de l'histoire de Saroo. Lion ne m'a pas ému plus que ça, pourtant je suis le premier concerné par la recherche du passé d'enfants adoptés. La première partie qui raconte les péripéties de Saroo en inde alors qu'il est petit est de loin la plus intéressante. Les visuels sont forts, les plans vraiment beaux... de quoi s'attacher au personnage et retranscrire à merveille la difficulté de ses enfants abandonnés en Inde.Même la partie de transition et la prise de contact entre saroo et sa famille d'adoption est très bien ficelé. Sunny Pawar est très convaincant dans ce rôle . C'est au moment de la deuxième partie que la balance penche du mauvais côté. Malgré le bon jeu d'acteur de Dev Patel le scénario s'enlise dans des facilités scénaristiques. L'évolution du couple lucy/saroo est au final peu intéressant. Même les conversations de Saroo et de sa mère adoptive jouée par Nicole Kidman ne m'ont pas convaincus. La réalisation n'innove plus et laisse place a une succession de plans des plus classiques et peu marquants. Je ne parlerai pas de la manière dont Saroo retrouve son village d'origine... spoiler:   Il retrouve donc sa ville au hasard sur google maps , je suis vraiment curieux de savoir si ça s'est passé comme ça dans le livre En résumé, un sujet fort scindés en deux parties très inégales. "
5.0," Film bouleversant relatant l'histoire de ce petit Saaro, mais aussi la condition de vie de ces petits enfants abandonnés...Musique envoûtante et chargée d'émotion..Mouchoirs à prévoir.. "
5.0," Très beau film, un vrai chef d'oeuvre très prenant et émouvant ...Certaines scènes sont à pleurer mais le dénouement est heureux "
5.0, courez y vite mais n oubliez pas vos mouchoirs. un film splendide une histoire vraie qui prend au bide.on se dit comment cela est possible ? 
2.0," un film long dont un des principals rebondissements est complètement oublié : celui de la vie du jeune homme après la découverte de sa vraie mère.le film est principalement accentué sur le périple du jeune garçon qui malheureusement manque de nouveauté, le petit garcon veut retrouver sa ville et tombe sur des personnes mal attentionné. ce film aurait dû exposé la vie du petit garcon en 30 min et non en plus d'une heure ! "
4.5," Une histoire touchante et plein d'espoir qui nous donne envie de croire en la vie et ses belles surprises. Le petit garçon est adorable, on s'attache dès les premières images et on adore déjà le jeune homme qu'il deviendra. "
5.0," Sûrement l'un des meilleurs films que j'ai jamais vu ! Une histoire très poignante. Je le recommande vraiment. Je n'ai pas décroché une seconde, il est touchant du début a la fin. "
5.0," Cela m'a pris du temps avant de finalement regarder Lion, un film qualifié de chef d'oeuvre du septième art et qui a, par ailleurs, été très bien accueilli par la critique des spectateurs. Et ma foi, c'est un film bouleversant qui évoque de manière décapante la triste réalité que vivent les enfant en Inde ! On suit les péripéties de ce petit héros : Saroo. Un héros attachant mais surtout attendrissant qui réussit à susciter la compassion du spectateur. Mais Saroo est également un superbe personnage qui est interprété, de la plus belle des manières, par un jeune garçon talentueux. La chute finale où on apprend finalement plus sur la signification du prénom du héros a donné un surprenant point final au chef d'oeuvre, Lion. Une véritable merveille cinématographique qui mêle émotion, compassion et réalité. Une perle parmi les galets du cinéma. 19/20 "
4.0, Très beau film. J'ai été pris au trip et embarqué émotionnellement dans cette histoire. Y a assez peu de suprise. On a pas besoin d'être surpris. On sait comment les choses vont s'enchaîner et malgré cela on prend beaucoup de plaisir à voir les etapes de l'intrigue prendre vie et se mettre en mouvement. Gareth Davis a vraiment fait un super boulot. 
5.0," Bouleversant, magnifique, superbe film. Le petit garçon qui incarne Saroo est émouvant, son destin est extraordinaire et on suit son parcours émus aux larmes, captivés tout au long . L'Inde est montrée avec sa misère et sa crasse mais laisse aussi une part de poésie et de beauté (papillons dorés). Tous les comédiens sont excellents. Moment d'émotion intense "
4.0, Très bon film très émouvant sachant qu'il est tiré d'une histoire vraiDev Patel est très bon dommage qu'il ne joue pas un peu plus de filmsMention spéciale au petit bout de chou très bien choisi et très attachant2/3 longueurs en milieu de film mais celà merite de les supporter pour voir ce vrai drame humain jusqu'à la fin 
4.5," Magnifique réalisation, les musiques sont également superbes sans parler du jeu d'acteur. A voir absolument ! "
4.0, Une histoire d’autant plus belle et émouvante qu’elle est vraie et qu’elle aborde de douloureux sujets d’actualité. Mise en scène globalement réussie. 
4.0," Très beau film.Le fait que ce soit une histoire vraie apporte bien entendu une intensité profonde au film.Le petite Saroo est tellement attachant, on a envie de pleurer sur son triste sort alors qu'il fait preuve d'une force mentale incroyable dès son jeune âge, ce qui lui a probablement sauver la vie et permis de traverser toutes ses épreuves avec un grand courage.Le dénouement du film est très beau, on en tire quelques larmes. "
4.0," Lion est un film extrêmement touchant, sans surprise. Les acteurs sont bons, très bons, et on ressent beaucoup de compassion pour le jeune Saroo. On verse une larme, plutôt deux fois qu'une, et on est touchés par cette histoire réelle. "
5.0," Je ne sais pas comment expliquer que ce film est majestueux. Un vécu intense avec beaucoup d'émotion, nous nous plongeons facilement dans sa vie. Vraiment je recommande d'aller le voir c'est fort comme histoire "
5.0, Un chef d'oeuvre ! Le jeune Saroo est grandiose ! Un film ávoir avec des kleenex .... Une bonne lecon de savoir vivre et de savoir être ❤ 
5.0, Préparez vos mouchoirs ! On a déjà vu plein d'histoire d'adoption mais celle ci est sublime. Les émotions que les personnages ont nous sont totalement perceptibles et entrent en nous profondément. En gros ce prend aux tripes. 
4.5, Waow! Quelle histoire!!! Les comédiens sont très bons et en particulier le petit Sunny Pawar. Allez-y sans hésiter!! 
3.5," La première partie du film est très bien réalisée avec de l'émotion et une aventure bien ressentie pendant l'enfance du personnage principal. La deuxième partie, donc le moment adulte, n'est pas très émotionnel, part dans certaines scènes un peu clichés et l'acteur n'est pas attachant. Ce film mérite d'être vu pour l'histoire qu'il raconte. "
5.0, Film merveilleux et bouleversant. À voir absolument car tout est formidable. Les acteurs sont magnifiques et tout particulièrement le petit saroo. L histoire est incroyable. Très belle musique également 
5.0, Très touchant quand on est parents !Ce film m'a arraché des larmes pourtant on m'appelles l'ours ...Musique et acteurs au top 
4.0, L'histoire du film est incroyable et très émouvant. Le petit comédien est super et j'ai beaucoup aimé la première partie en Inde. 
5.0, un film exceptionnel rempli d émotions et qui vous met le baume au coeur. on ressort de la salle les larmes aux yeux et avec le besoin d'aider le monde entier 
4.5, Magnifique film!! On voyage... Il ne manque plus que le parfum de l'Inde... On s'y croirait! On est transporté dans l'histoire! 
