Note,Commentaire
4.5," Une variation amusante et fort réussie sur le thème des mondes parallèles, et des doubles, ici ceux de Spiderman, plus ou moins ( et c'est là que c'est drôle) semblables, amenés à se rassembler et à coopérer efficacement contre le Mal. "
4.5," Animation ingénieuse et sublime, histoire surprenante et entraînante, bons doublages. Que dire de plus ? Qu'il s'agit du meilleur film de super héros de l'année et de loin ! "
4.5," Spider-man Into the Spiderverse est un film d'animation pur jus, impossible à refaire en live-action du à son animation magnifique proche des comics et d'un style visuel et de montage incroyable.Miles Morales est ultra touchant et sa richesse d'écriture permet un attachement quasi immédiat à lui.Les autres personnages, tous plus ou moins développés sont intéressants et aucun des 6 spider ne semblent de trop en tant que Sidekick.Un superbe film d'animation, l'un des meilleurs de la décennie mais qui reste selon moi un tout tout petit peu derrière les Spider-Man de Sam Raimi qu'il cite d'ailleurs en exemple. "
5.0," Une super surprise que de Spider-Man New Génération tant au niveau de l’histoire que l’aspect graphique.C’est au début un peu troublant avec ce dessin qui reprends l’aspect comics et originel mais utilisé à très bonnes doses, et puis cette idée de différents Spider-Man, avec chacun leur style, c’est tout bonnement une super trouvaille (le cochon, c’est un hommage au spider cochon des Simpson ?).Avec des personnages géniaux, même Tante May est excellente, elle, qui toujours cantonnée à la petite mamie, et puis un humour mordant, bref je suis épaté par ce film.Il n’y a pas beaucoup de films comme ça où il y a une synergie entre l’originalité, l’histoire, les personnages, le graphisme, l’humour et l’action. Ici, tou y est. "
4.0," Voilà un film qui a tout compris à l'univers de Spider-man : un super-héros avec des questions et des problèmes d'ordre privées, de l'humour, de l'action frénétique et de haute-voltige. D'ailleurs visuellement mais quelle claque !! Entre le fait d'utiliser plusieurs styles graphiques, de mélanger ça avec de la BD et que l'action aussi mouvementée soit-elle reste pratiquement tout le temps lisible, une totale réussite...sauf l'animation quand ""c'est calme"". C'est un parti pris, mais ça donne l'impression qu'il n'y a que 12 images par seconde, ça me fait enlever une demi-étoile à ma note car ça me dérange vraiment. Mais le reste, si on aime Spider-man avec son histoire, ses répliques vraiment drôles, alors c'est LE film à ne pas louper !! "
4.5," ""Spider-Man : New Generation"" embrasse d’une manière incroyable l’univers de Spider-Man en lui rendant l’hommage qu’il méritait depuis des années. Certainement le meilleur film d’animation sur le super-héros, et l'un des meilleurs films tout court de 2018. "
5.0," Un film réussi de A à Z meme si de temps en temps je me sentais exaspérée par l'attitude ""béate' du jeune garçon, main en l 'air avec sa précieuse clé usb devant l'ennemi, mais le fait de ressentir cela est bien une marque de la qualité de ce film animée , intriqué par la BD de façon magistrale. à ne pas rater, un chef d'oeuvre dans le genre "
0.5, peter parker se fait mordre par une araignée ont a même le droit a certaines scènes de la trilogie de sam raimi quand il dance dans la rue . puis retour a la réalité spider-man est tué en deux secondes plusieurs spider-man arrive avec même un cochon spider-man !!! tante may connais l'identité secrète de peter une bat-cave spider-man ? 
5.0," Une très bonne surprise. Animation originale, au top. Bande son de qualité qui promet quelques frissons.J'ai passé un très bon moment, et je suis même retourné le voir.Miles 👊🕷� "
1.0," Personnellement, je trouve que ce film est vraiment mauvais. L'histoire peut aller, mais l'animation et les graphismes sont nuls et moches. Je ne comprends pas pourquoi les studios ont produit un tel film qui s’eloigne autant de l’univers Marvel. "
3.0," C'est original, oui, et assez bien foutu. Sauf que depuis Mutafukaz est passé par là, et ce Spiderman ne lui arrive pas à la cheville niveau animations et folie, car on ne peut s'empêcher de rechercher des points communs entre les deux. Pour moi il va faire partie des Marvel que je vais vite oublier. "
5.0, Je suis allée le voir avec mon fils tres bon film. L'histoire et les personnages sont bien expliquer 
5.0, Çe film met un grosse gifle tellement visuellement ça envoi dans tous les sens!!!tres surpris et vraiment je le conseil! 
5.0," Absolument incroyable. Ce film fera date dans l'histoire du cinéma d'animation. À l'heure où les productions de super-héros ont du mal à trouver un second souffle, ce New Generation détonne par son énergie et sa créativité folles. Une réalisation virtuose, bien servie par un scénario inventif, et un humour parfaitement dosé. Une des plus grosses claques que j'ai pris au cinéma. "
4.0," Oui c’est réussi je l’admet le film est excellent 4/5 Meilleur idée du film les Références aux films de Raimi aha la scène de Danse mon Dieu j’adore cette scène, j’aimerai revenir sur le fait que beaucoup disent que c’est le meilleur Spider-Man alors oui il est réussi mais je suis désolé c’est pas le Meilleur Spider-Man on ne compare pas un Film d’animation à un Film. Le Meilleur Spider-Man restera à jamais Spider-Man 2. "
0.5, C'est long mais tellement LOOOONG!! au bout de 40 min de film y se passe toujours rien. Les blagues c'est juste des chutes (littéralement je veux dire). C'est bourré de clichés en plus bref ça vous plaira si vous avez 12 ans au dela je vous le déconseille fortement. 
4.0," Spider man étant mon super héros préféré , j'attendais ce film d'animation avec impatience et il est vraiment réussi. Dès les premières images, on prend une claque tant le graphisme et l'animation sont excellentes. Le film peut paraître enfantin mais c'est le contraire, on se retrouve avec un long-métrage plutôt mature (la mort de l'oncle de Miles en est un parfait exemple). Attention, si votre enfant est assez jeune (en dessous de 7 ans), il ne comprendra peut-être pas toute cette histoire de dimension. Ensuite, voir tous ces spider men à l'écran est juste énorme bien que spider cochon ou le méca sont dispensables. L'histoire, c'est du spider man, je n'en demandais pas plus.Vu en Vf, la voix du Scorpion est très mauvaise (merci Kimpembe) mais ce n'est dérangeant, étant donné qu'il n'a que 8 lignes de dialogues max. Petit point noir par rapport à Tante May, le fait qu'elle soit au courant m'a paru bizarre et le QG fait de trop.L'humour fonctionne et les scènes d'action sont impressionnantes. Je conseille si vous êtes fans de l'araignée et même si vous ne l'êtes pas.Pour comparer, ce film est égalité avec Les Indestructibles 2 et inférieur à la trilogie de Sam Raimi.Malheureusement, le film n'a pas le succés qu'il mérite. En tout cas hâte de voir la suite (s'il y en a une). "
5.0, Un grand masterpiece pour ce film d’animation. Très original avec la technologie de stop-motion. Un grand Spider-Man. 
4.0," Spider-Man New Generation est un concentré du meilleur de la culture comics qui aurait été portée tel quel à l'écran. La reproduction des pages de comics, avec par exemple les pensées du personnages apparaissant dans un rectangle jaune, lui assure un style véritablement à part dans le cinéma. On est à mi-chemin entre la BD et le film : une sorte de dessin animé avec des bulles de textes, des bruits d'impact écrits à l'écran. Et c'est vraiment réussi. Le déroulement est sans temps mort, les plans spectaculaires s’enchaînent, les relations entre les personnages s'étoffent. Et au niveau du scénario, c'est plutôt réussi également avec l'exploitation sans trop d'excès du multivers et l'apparition des 5 autres spider-man et woman depuis des univers parallèles qui filent un bon coup de main au tout nouveau spider-man de notre réalité pour pouvoir repartir dans la leur. Une vraie belle réussite. "
4.5," Une énorme claque visuelle qui renvoie les précédents épisodes de l’homme araignée aux oubliettes. Un chef d’oeuvre !!! L’image est tout bonnement extra ordinaire et fait référence aux comics du début (texture, flou..), la bande son est un must have avec un panel aussi éclectique que réussi, le scénario est très malin malgré un léger creux au 2/3 du film et les personnages très charismatiques hormis la fille issue du manga voire le spider cochon moyennement convaincants. Courrez voir cette pépite (enfants admis mais pas forcément obligatoires à mon avis), vous ne serez pas déçu. "
5.0," Tout y est, un visuel original et très graphique, une super BO, des personnages touchants, et un rythme efficace. Un de mes Marvel préférés sans aucun doute. "
4.0," J'ai trouvé que c'était un très bon film d'animation, mêlant à souhait les différentes techniques de dessin et modélisation numérique. L'humour est dilué à souhait dans une intrigue qui nous sort des sentiers battus confortable du cinéma de genre où l'intelligence du super héro n'a d'égal que sa clairvoyance au service de ses muscles. "
3.5," B.O 788 719Un Spiderman en mode animation...je fonce!! Bon qu'avec mon Choupi car Mr Adam trouvait les dessins ""hum pas très jolie"" (bon j'avoue que je trouvais bizarre aussi sur la bande annonce) ben tant pis pour lui car le film est une très bonne surprise!!! De l'action, de l'humour, de l'émotion et une histoire qui tiens la route et bien presque 2 heures mais persos on les voient pas passer du tout!!Très agréable à suivre et ce mélange de l'animation moderne avec le style BD est une belle réussite. En tous cas Romain était passionné.Concernant la scène post-générique, sert à rien mais marrante donc resté!^^NOTE: 7.5/10 "
5.0," Une adaptation de plusieurs comics Marvel avec leur héros distinct qui est exécuté d’une manière exemplaire ! Tout y est, ce film d’animation est une perfection! Humour, action, aventure et j’en passe sont plus qu’à la hauteur d’un nouveau chef-d’œuvre mare un Marvel!!! Merci pour ce moment d’exception que j’ai vécu dans ma salle obscure. "
4.5," Bonjour j'ai pu voir Spider man new generation cette après midi malheureusement en vf car mon cinéma ne proposait pas de séances en vo. Personnelement j'ai toujours apprécié le personnage de spider man ( surement mes comics préférés)et surtout j'ai beaucoup aimé la trilogie de sam raimi ( même le 3 que j'ai trouvé assez bon ) qui est pour moi la meilleure saga sur spider man . Sont ensuite arrivé les 2 The amazing spider man que j'ai pas trouvés mauvais mais qui pour moi n'avaient aucun intérêts à part recycler la trilogie de sam rami en moins bien avec de meilleurs effets spéciaux . Après ces deux volets est arrivé spider man homecoming que j'ai trouvé plutôt bon car il était fidèle aux comics et ne nous racontait pas la même histoire comme l'avait fait The Amazing Spider Man . Bref Spider Man est sûrement mon super héros préféré que ça soit dans les comics ou dans les films car je trouve que l'on s'attache beaucoup à Peter Parker et qu'on se sent nous aussi un peu nous aussi un peu comme Spider Man. Ce nouveau Spider Man n'était pas trop attendu pour ma part car c'est un dessin animé et que je préfère les films la plupart du temps mais ayant vu les critiques très enthousiastes j'ai était de plus en plus hypé par ce film alors que la bande annonce ne m'avait pas spécialment donnée envie et quelle claque je me suis pris ! Ce film est un petit chef d'oeuvre qui pour moi concurrence avec la trilogie de Sam raimi et qui même la dépasse. Déjà le visuel de ce film est incroyablement beau , je crois n'avoir jamais vu un dessin animé avec un visuel aussi recherché et beau : quel travail !Ensuite le film en lui même aussi est très bon , drôle,touchant et très ryhmé ( on ne s'ennuie jamais dans ce film entre bonnes blagues,visuels incroyables,combats rythmés et moments touchants) . Bref pour moi c'est un grand OUI ce film est une excellente surprise que je recommande chaudement et que j'ai déjà envie de revoir tellement j'ai passé un bon moment et en plus ce film m'a donné envie d'aller voir bien plus de dessins animés même si je doute de retrouver des dessins animés aussi bon . Bravo à toute l'équipe du film pour cet excellent dessin animé familial ! "
4.0," Ce film pousse les films d'animation vers un nouveau niveau.J'y suis allé un peu à reculons après une bande annonce moyenne, mais quelle claque. Ce film est magnifique. Une vraie bonne surprise. "
5.0," Alors là ...J'ai beau être ce qu'on appel un Fanboy du MCU je dois avouer une chose, Sony a su faire un spider man qui ne pourra que difficilement être égalé.New génération est de loin l'histoire la plus profonde que l'on a pu nous offrir en terme de film de super héros. Et je parle bien de film tellement l'animation est supérieur à tout ce que l'ont nous a servit à l'heure actuelle.En regardant ce chef d'oeuvre, on ne peut que s'émerveiller et l'on a hâte de découvrir les nouvelles aventure de Milles Morales.Sans oublier une Bande Son à faire pâlir les plus gros productions hollywoodiennes.J'ai ris, j'ai pleuré, bref, j'ai passé l'un de es meilleurs événement cinématographique. "
0.5," Je trouve le tapage autour de ce Spider-Man et tous les avis positifs totalement anecdotiques... Le scénario est stellaire, tiré par les cheveux au possible et d’une mièvrerie... Vous avait aussi droit à d’autres versions de Spiderman qui mettent vos nerfs à rude épreuve et font totalement sortir de ce film (si on peut employer ce mot)De plus c’est franchement insupportable à regarder tant le balayage de l’image donne l’impression d’avoir un stroboscope braqué sur les yeux pendant toute la durée, c’est tout simplement désagréable et inutile. On frise l'épilepsie !Éventuellement un film destiné aux enfants en très bas âge mais à déconseiller aux adultes et surtout au puristes... "
4.5," Oscar du meilleur film d’animation en 2019, Spider-Man : New Génération est la révolution qui a surpris tout le monde. En effet, ce bijou d’animation, s’est attaquer à l’univers étendu du héros le plus populaire, Peter Parker alias Spider-Man. Est la chose n’est vraiment pas aisée quand seuls les fans de comics peuvent connaitre ce riche monde. C’est ainsi que le long métrage opte pour une technique originale de création, qui déploie un univers proche du comics. Dès le générique, les effets visuels, les bulles de dialogues, les onomatopées s’enchainent pour nous faire rentrer progressivement dans un monde jusqu’alors réservé au format papier. Sous nos yeux prend vie une véritable histoire de héros, où tout est colorée. Une animation unique en genre, futuriste, pop, qui joue avec les codes du comics et en profite pour user de tous les moyens que nous offre ce média pour créer un univers qui dépoussière totalement le genre. Fini le film d’animation pour enfant, ici, l’histoire à la portée de tous, reprend l’origin story du personnage Miles Morales et le transforme en grand successeur de Spider-Man. Accompagné par les autres versions de l’homme araignée, dont la plus célèbre, Spider-Cochon, cette troupe de héros connu des amateurs, rafraichit totalement l’univers que le grand public se fait de la célèbre araignée. Tout en restant accessible au grand public, cette superbe histoire du héros qui découvre ses pouvoirs, ce qui est assez classique, n’oublie pas d’user de quelques références comme il est de coutume chez Marvel. La seule chose reprochable, c’est que Miles Morales ne s’éloigne jamais bien loin de la célèbre phrase « de grands pouvoirs implique de grandes responsabilités », ce qui nous fait penser que ce héros reste tout de même dans l’ombre de Spidey plutôt que de constituer sa propre légende. Malgré cela, Spider-Man demeure l’inspiration de nombreux héros, qu’ils soient réels ou imaginaire, ce qui reste un bien pour cette figure légendaire du comics. Bien loin du MCU, Spider-Man : New Génération s’impose indéniablement comme l’un des meilleurs films de super héros de ces dernières années, n’ayant rien à envier aux gros blockbusters qui nous présente chaque année les Avengers. "
5.0," C’est tout simplement le Spider-Man ultime. Rendant justice à ceux qui comme moi, restent très déçus des dernières adaptations cinéma (« surjeu » gênant des acteurs principaux, scénario pleins de mièvrerie, redondance d’un film à l’autre). Ici, déjà, vous allez voir une animation époustouflante, jamais vu auparavant et servant une vrai synthèse des différentes versions des comics. Le tout mis en action et en image ultra HD ! Ça envoie, c’est coloré et agréable à regarder, sans ne jamais trahir le style des bandes dessinées ! On retrouve jusqu’au grain des dessins. Du point de vue du scénario, Spider-Verse, sorti en 2014, est un forme d’hommage aux différentes versions de Spidey. Comme un ultime crossover des différents type de Spider-Man présents du classique au plus moderne, et qui repose sur un système de dimensions parallèles. Les personnages ont tous leurs qualités et leur storyboard : ils sont plutôt riches et attachants. Pour les fans de l’homme araignée, c’est à ne manquer sous aucun prétexte, pour les autres, la prouesse technique et artistique est à découvrir. "
5.0," franchement je m'attendais à ce qu'il soit bon mais pas à ce point. Très accessible et en même assez mature, les parents s'y retrouvent aussi. Quant à la réalisation et l'aspect technique, on est vraiment dans du très haut niveau. Les personnages sont intéressants, le méchant à la hauteur, je crois qu'il ne faut pas hésiter une seconde, ce film rempli parfaitement son rôle dans le renouveau de la licence autant pour les nouveaux que les fans du tisseur "
3.0, Dessin animer bien mais sans plus j ai ete un peu gener par le saccade de l anime . 
5.0, Incroyable style visuel !Scénario novateur et efficacité de la mise en scene !Reinvention de la franchise de spiderman de façon inattendueBref le dessin animé de l'année et le film de super hero de l'année.Je cours le revoir dans une semaine ! 
5.0," Démentiel !Scénario très bien fait, bande originale au top, humour parfait, j'ai adoooooré !Rafraichissant, mérite vraiment un 5/5 !! "
3.5, Alors moi je dis bravo un spiderman noir il était temps de le voir sur grand écran... Aller avec le fiston de 6ans il as pas tout compris beaucoup de retours en arrière et la notion de mon parallèle difficile à comprendre pour le petit bout. À coter de cela un peu long le film 2h c'est trop. Coter positifs les différents personnages spiderman sont bien intégrer au film l'harmonie donne un bon film. 
4.5," Très prenant du début à la fin. Des dessins et un scénario original, malgré un personnage vu et revu. Après une grosse déception pour Venom, Sony réussi à nous surprendre avec ce superbe film d'animation, qui conviendra aux fans du héros et à toute la famille. Une claque. "
4.5," Spiderman mérite sa note sur AlloCiné ! une réalisation impressionnante qui ne cesse de nous en mettre plein les yeux tous au long du film. Une histoire intéressante, de l'humour bref tout pour passer un très bon moment "
4.5," Super sympa, innovant, juste dommage que les français aient changé le titre l’original claquait plus! Ça change et l’humour au top! Le grain de l’image une tuerie! Bref on a adoré! "
0.5," Ils ont ruinés l’image de Spider-Man !Rien d’autre a dire, juste du grand n’importe quoi,ou est Andrew Garfield !!!!!!! "
5.0," Que dire sur un des films que j'attendais le plus en cette fin d'année, Sipder-Man : New Generation signe un long métrage au départ risqué pour les studios de Sony Animation mais qui en sort juste parfais. Rien n'a dire d'autre que : WOUAW quel claque !Un sans faute pour un nouveau genre dans la saga Marvel et Spider-man qui tente un nouveau type d'animation plus cartoon mélangeant les styles d'animations et les bonnes idées de mises en scène. Des plans de caméra toujours plus osée qui en mettent plein la vue, des couleurs magnifiques et un style d'image différents pour chaque scène tous ça sur fond de rap US très posé interprété par Post Malone et Swae Lee.Bref que dire de plus, tout est parfait les personnages sont attachants et drôles, le message est fort, la mise en scène regorge d'idées merveilleuses, le seul bémol est peut-être la présentation des personnages qui a force de devenir récurrent peut allonger les films de quelques minutes répétitives.Mais bien sure tous ça n'est rien à coté de tout le reste qui est incroyablement bon. Je conseille donc Spider-Man Newe génération qui s'avère être une énorme claque aussi bien d'animation que de scénario qui marquera une place belles place en cette fin d'année et pourquoi pas le début d'une alternative à tous les films Marvel qui ce ressemble tous les uns les autres. "
4.0," Jeudi 3 janvier 2019 : nous avons beaucoup aimé ce film d'animation.Ce ""Spiderman"" ose tout et réussit tout avec beaucoup d'humour et un graphisme d'une très grande qualité.Il fait référence à tous les autres ""Spiderman"" "
5.0, purement et simplement le dessin animé de cette année 2018. une innovation jamais instoré dans un long métrage . le mélange du comics et dessin intégré a la CGI est un mixe qui marche parfaitement en plus de faire le choix d'intégrer moins de 24 images par secondes pour confondre comics et écran. Un scénario génial avec des personnages très fort un humour très pointu et qui tombe juste a chaque instant et une VF parfaite !!! une pure dinguerie ! 
2.0," Je pense que j'ai ma dose de films de super héros, avec les m^mes thématiques répétées à l'infini. Ce spiderman ne fait pas exception et ne sort pas du lot. Et ils ont réussis à gâcher une qualité d'animation et une direction artistique de haute qualité par un rythme bcp, bcp trop survolté. On tombe dans les travers des Avengers and co, où la surenchère visuelle devient très vite lassante (trop d'action tue l'action). Je sais pas au ciné mais en DVD 1/3 des dialogues passe à la trappe dû à un mauvais mixage avec la musique, pas cool. A côté de ça le scénario ne m'a pas captivé, pas d'attachement aux personnages et rien de bien original au final, j'ai du me forcer à regarder jusqu'au bout tout en surfant sur mon smartphone) .Donc contrairement à la majorité, je ne crie pas au chez d'oeuvre, mais plutôt au gâchis. "
5.0," A mes yeux , deux recompenses pour ce filmPeut etre le meilleur spidermanEt peut etre le meilleur film d animationUne claque visuelle s enchainant apres une autre claque visuelle.De l humour , un scenario remplis de surprises, de l action, des renversements scenaristique, vraiment que du bonheur ...Une immense surprise Je deconseille de voir la bande annonce , a voir en 4k et avec du son "
4.5," Une œuvre d’art et à la fois une preuve d’amour envers l’univers Spiderman. Le film est une réussite artistique, propose une expérience avec des codes esthetiques très élaborés sans pour autant se piéger dans de la haute définition avec une image 120 fps. Le scénario est vraiment plaisant et drôle et on ne s’ennuie pas jusqu’à la dernière seconde. En tout cas cette nouvelle génération apporte un florilège de nouveauté à tisser pour la toile de notre homme araignée. "
4.5," Pas particulièrement fan des Marvel, j'ai été surpris par l'histoire, très différente des films, tout en faisant le lien avec intelligence. C'est malin et bien vu.Mais plus encore, ce qui étonne, c'est la qualité de l'animation, très graphique et proche de la BD. Époustouflant.A voir même si vous n'accrochez pas aux super-héros. "
5.0," Spider man new generation est le meilleur film d'animation de 2018 et relance la franchise quelque peu cahin-caha. Ce film est exceptionnel dans sa conception scénaristique et graphique. Le visuel est incroyablement beau ( mention spéciale en 3D ), nouvelle ère d'animation folle. Étourdissant de maîtrise, ce film nous transporte, durant deux heures, sans difficulté, dans ce monde multivers où se retrouvent pêle-mêle nos différents « spidervers » pour aider le jeune Morales à ramener tout un chacun vers son propre univers, et restitue, à la même occasion, le sens positif de sa vie d'ados. Mais pas que.. "
3.0, Quelle belle surprise se multivers. Et avec une pointe de humour et très bien orchestré. Paris réussit pour se Spider-man. 
4.5," Une animation juste géniale, à ne surtout pas manquer! Après ""Spider-man : Homecoming"" qui m'avait beaucoup déçu, voilà un Spider-man intéressant, avec de bonnes scènes d'action, une touche d'humour très bien placée et efficace, une histoire prenante et captivante. Bref, un petit bijou. "
5.0," Sûrement le meilleur film que j'ai vu de ma vie , les graphiques sont magique on a un plaisir fou à le regarder , l'histoire est parfaite , elle reprend tout les éléments des anciens spiderman, ce qui donne un résultat sans faille . Bref le film est tout simplement beau . Je le conseille énormément , vivement le deuxième film !!!!!! "
5.0," J'ai adoré ce film, le langage des jeunes est très bien utilisé et il est plus facile de s'identifier à un Miles Morales plutôt qu'à Spider Man joué par Tobbey Macguire. "
