Note,Commentaire
5.0, INCROYABLE !! Il n'y a pas d'autres mots. A mes yeux le meilleur Spiderman de la saga et l'une des meilleures productions Marvel Bravo franchement et merci pour ce moment de plaisir 
0.5,  Beaucoup de bavardage dans ce film. L'histoire est très complexe. Peu d'actions. Vivement un nouveau cycle avec de nouveaux acteurs . 
5.0," Ce film est une pépite, le défi du multivers a été bien réussi.Voir le retour du bouffon vert interprété par Willem Dafoe quel nostalgie...  spoiler:  et le retour d'Andrew et Tobey je n'en parle même pas, la salle de cinéma était en feu c'était une ambiance de dingue  Si vous n'avez pas vu le film je vous conseil d'aller le voir "
5.0," INCROYABLE ! Tout simplement le meilleur Spider-Man, y'a tout, absolument tout. Du Fan service à gogo, des combats, de l'émotion, des effets de ouf, Doctor Strange. bref les 2 heures 40 passent super vite. 5/5 "
5.0," Tout simplement incroyable. Je n'ai rarement vu une salle de cinéma autant en ébullition. Du spectacle et encore du spectacle. Du fan service, mais c'est bien ce qui fait plaisir. "
4.0," Très bon, avec des scènes très bien faites et un scénario tout à fait correct pour un Marvel. Quelques passages un peu trop tirés par les cheveux. J'étais dans une salle avec des gens qui applaudissaient toutes les 15 minutes, je n'en étais pas là mais c'est plaisant à voir ! "
4.0," Magnifique, Grandiose, du fan-service comme j'aime, bien sur je ne spoilerai pas, mais j'ai été conquis, en tant que grand fana de Spidey j'ai été aux anges. +4 "
3.5," CRITIQUE POUR TOUS SANS AUCUN SPOILERSOn ne va pas faire durer le suspens. Allons droit au but. Le film est cool. On passe un bon moment. Il surfe et capitalise sur la fibre nostalgique et…ça s’arrête là. Et oui c’est un peu le soucis me concernant. J’aurai aimé que ça creuse un peu plus sur le fond plutôt que sur la forme. Le film va rassembler les fans de toutes les générations de Spiderman, le fan service omniprésent jusqu’à même en devenir maladroit voir ridicule de temps en temps en ravira certains comme il en décevra peut être d’autre par moment. Il aurait été bon, de mon point de vue, et c’est très subjectif, de maîtriser ce côté fan service qui finalement peut tomber dans l’excès. Il y a de très bonnes idées, mais j’ai trouvé également que pour quelques passages, soit il ne va pas assez loin et y va en timide, soit il devient maladroit, gênant et va même jusqu’à enlever toute identité à ce nouveau film. En revanche il est important de préciser que ce nouveau Spider-Man est le meilleur des trois films de Tom Holland, et de loin, c’est indéniable. Points positifs : Tom Holland n’a jamais aussi bien incarné le tisseur que dans cette nouvelle aventure. Plus mature, plus dur, plus sensible par moment. J’ai beaucoup aimé son jeu dans ce spider man. J’aime beaucoup ce gars. Zendaya, Tom Holland et leur side kick « Ned » forment un trio super attachant. Docteur Strange et sa magie sans limite.Du Fan service bien choisi qui va clairement ravir les fans de toutes heures…Points négatifs : …mais le fan service c’est bien malheureusement il a aussi ses limites. Et par moment on tombe dans ce que je redoutais le plus à savoir le mauvais clin d’œil, celui qu’il ne fallait peut être pas faire, la réplique qu’il ne fallait surtout pas reprendre. Alors qu’au contraire ils avaient le potentiel de faire des scènes extrêmement marquantes. Je les attends toujours… Justement ça manque de scènes épiques et d’envergures. Je ressors du film sans un moment qui me reste en tête. Quand on voit les moyens à disposition en terme de casting, on aurait pu aller beaucoup plus loin, nous sortir des scènes épiques et ne pas nous laisser sur notre faim…Scénario archi survolé. Ça manque clairement d’écriture. Ca sonne creux. Alors oui on me dira « tu t’attendais à quoi d’un film Marvel ». Je crois que l’on peut nous servir du divertissement avec un minimum de fond, d’écriture et de sens à nous donner. Conclusion : Un bon film spiderman, le meilleur de la dernière trilogie, avec du fan service qui marquera le cinéma de super héros tant le pari de ce qui a été fait est réussi et historique. On peut dire que c’est une première. Seulement cela manque de mise en scène. On nous sert tout le catalogue de clins d’œil sans trop de mise en forme. Et quand on réfléchit bien…il ne nous reste pas grand chose en tête après séance si ce n’est la multitude de références « fan service » qui nous a gentillement caressé la corde sensible de la nostalgie. Ce qui donne finalement à mes yeux un coté presque plus best of que nouvel aventure. Dernier conseil, restez bien jusqu’à la toute fin du générique pour un petit bonus sympathique 😉 "
5.0," Je vais résumer ce film en 1 phrase: un rêve devenu une réalité.Il est clair qu'en terme de réalisation, il y a mieux. En terme de mise en scène, de surprises et de Multiverse de Marvel... c'est la perfection à l'état pure.Merci Marvel pour cette pépite de Noël "
0.5," malheureusement, pas possibilité de :mettre zero ou -1 etoile...je perd rarement mon temps à mal noter un film, je préfère commenter les bons films qui meritent ce temps..point positif: bon de reduction de 7.5€ pour autre filmpoint negatif: LE filmdes le 1ere min, on s'ennuie royalement. aucun suspens, dialogues pitoyables. vu les effets spéciaux, il auraient pu se payer un scénariste et des dialogues... car il faut un âge mental de 5 ans pour rentrer dans ce film. avec des scènes tellement grosses et impossibles que ton cerveau arrive pas à y croire (je sais bien que c de la SF mais qd meme) malgré des efforts. acteurs pas convaincants (ils doivent eux aussi savoir que c'est nul). le réalisateur devait penser que plus on s'ennuie, plus il faut des gros effets spéciaux et explosions immenses (planétaires voire galactiques)Parti avant la fin comme d'autres et suis resté 30min(?) car j'ai voulu rentabiliser et espérer que ce soit juste le début qui soit pénible... un des plus gros navets de ma viebref si vous avez 12e à gaspiller, allez y !ou donnez les plutôt à une oeuvre. je m'explique pas comment on peut noter CA 4 étoiles "
4.5," Humour bien dosé, scènes d'action époustouflantes (en 3D Imax), [spoiler] c'est tellement bon de revoir les acteurs d'anthologie reprendre leurs rôles respectifs. J'ai kiffé ce film et je serai capable de retourner le voir, peut-être en 4DX cette fois. Merci à l'équipe du film pour ce beau moment. "
1.0," tout ça pour çamoi qui est adoré les spiderman de Sam raimi et détesté les 2 Amazing Spider-Man ainsi que le dernier, j'ai attendu celui là avec impatience bon le multivers copié sur DC encore la je passe mais là quel fut ma déception totalevraiment le scénario est du déjà vu et parfois c'est long et l'humour pré ado débile laisse a désirermoi qui pensais voir les 3 spidermans réunis pendant la moitié du film non juste 15 mnen résumé il vaut mieux attendre qu'il passe à la TV que de dépenser pour rien "
1.5," Sans exagérer, j'ai vraiment passé la première moitié du film (et plus en fait), à me dire ""mais que c'est nul"" et genre vraiment nul, j'utilise rarement ce mot pourtant. Jeu d'acteurs à la ramasse, scénario ridicule. Même Strange a l'air de ne pas savoir ce qu'il vient faire dans ce film pour ado qui semble ne rien vouloir prendre au sérieux.À force de briser toute forme de sérieux et de tension avec un humour lourd (parfois bien trouvé mais noyé dans le reste), c'est très difficile de vouloir faire des scènes émouvantes ou simplement touchantes. Aucune tension, aucune émotion rien du tout. Même le début qui aurait pu être intéressant est complètement raté.Le public autour de moi criait et applaudissait dans la salle, et je me disais intérieurement ""il leur en faut vraiment pas beaucoup"".Heureusement la fin remonte un peu le niveau avec quelques scènes bien trouvées, mais sinon quel désastre... et pour le coup la partie un peu mieux est déjà repompé d'un film d'animation récent. Je comprends vraiment pas l'engouement pour ce film ni les critiques...Par contre ça donne vraiment envie de voir un nouveau Dr Strange "
5.0," Un excellent film et les nostalgiques seront ravis.Énormément de références aux précédents films Spiderman. Seul défaut, quelques longueurs et dialogues sans intérêts. "
3.5," Mon dieu, le gachis!!! Il y avais pourtant de la matière pour faire une bombe! Scénario zéro en ce qui concerne les sinister six, un coup méchant, un coup gentil... faut vraiment débrancher pour accrocher à cela... Fan service du même niveau... espérons que le reboot soit de qualité. Ne parlons même pas de la scène post générique qui est une simple bande d'annonce qui nous en montre beaucoup trop à ne surtout pas regarder! "
2.0," Gros fan du MCU, j'attendais ce film avec impatience ...Je met 2 étoiles, 1 pour chaque ... vous m'avez compris.La matière était bien là mais l'exécution est terrible. Jon Watts est un Yes man, on le sait. Mais il aurait pu faire un effort sur la mise en scène. Là, il n'y a rien, strictement rien. Une seule scène de 4 secondes est à retenir.Je crois que c'est le pire faux pas de Marvel.Ça me dégoutte parce que ça aurait pu être tellement mieux et énorme ... mais non. "
5.0," Tout est bon !!!Et une salle qui applaudie à 3 ou 4 reprises, ce n'est pas tous les jours !Bravo à toute l'équipe du film "
3.5," Un film de Fan Service, voir Andrew et Tobey c'est trop enfin les fans service sont heureux c'est sur mais bon je m'attendais à mieux, après il est bien dans l'ensemble mais bon ce serai bien que les gens et ainsi que Sony cesse de diffuser le film et faire des photos fuités... Conclusion on a presque tout vu... J'espère qu'ils vont faire un film de Spider Man pas pour fan service mais pour le public entier, faire un spiderman avec une force qu'on a jamais vu, qui bluffe le public et les gens également... "
4.5," Totalement dingue ce Spider-Man No way home !Du scénario original aux effets spéciaux hallucinants, ce dernier volet des aventures de l’homme-araignée offre un véritable divertissement généreux. On en prends plein les yeux pendant 2h30, mais le film n’est pas dénoué d’humour pour autant comme à son habitude, voire d’émotion.Du grand spectacle qui ravira les plus grands fans sur plusieurs générations, et sans doute le meilleur Marvel pour moi depuis Avengers Endgame.Alors oui il y'a quelques défauts mais personnellement je les ai vite oublié tant le reste en vaut la peine.À voir en Imax 3D si vous en avez la possibilité. Immersion totale et frissons garantis !Et restez bien jusqu’à la toute fin (il y’a deux « scènes » post-générique). "
4.5," Le fan service peut-être pertinent si c'est ce pourquoi vous aller voir le film, ici tout était prévu et annoncer. Le menu étant connu, difficile de feinter la surprise et se plaindre. La nostalgie à marché pour moi, parfois le cinéma c'est aussi savoir perdre son objectivité pour se laisser porter par les émotions, elles étaient au rendez-vous.Je regrette néanmoins une réalisation sans identité, sans ce coté grandiose et une approche de la ""surprise"" dans un décor de cuisine banal. "
5.0," Peut être que Tom Holland était Peter Parker, pour moi il est devenu Spider Man dans ce filmLe Multivers représente un potentiel jamais envisagé au cinéma. Aujourd'hui Marvel signe le symbole d'une toute nouvelle avancée dans le médium. Il y aura un avant et un après Spider Man No Way Home.Aller voir un Marvel est devenu un acte quasiment religieux aujourd'hui "
5.0, J'étais impatient de voir ce 3ème volet des aventures de spidey Avec Tom Hollande et j ai adorer c étais au dessus de toute mes attente et au dessus de toute les théories que l'on pouvais voir sur internet avant la sortie du film. Marvel a assurer du début à la fin ce film est juste exceptionnel on approche de la perfection. Pas un seul temps mort on ne s ennuie pas une seule minutes. Tans de promesse pour la suite de l univers Marvel. L'attente va être longue jusqu'au prochaine aventure de spider man. 
3.5," La parfaite illustration d'un gros exercice marketing parfaitement huilé et prévisible.Bref, tout ça pour ça. Le film est bon sans plus , tout est prévisible ,on sais à l'avance ce qu'il va se passer et qui va apparaître ...Le contraire aurai été mieux et aurai créé un effet de surprise ...Pas le meilleur Spiderman pour moi ..Dommage "
5.0," C'est un film tout bonnement spectaculaire. Rempli de tristesse, d'amour et d'action. Je crois que je n'ai jamais autant pleuré pour un film Marvel ! Rien à dire, il était grandiose et si vous êtes sentimentale comme moi préparez vos mouchoirs ! Le jeu d'acteur de Tom Holland  spoiler:  et des deux autres spiderman sont tout simplement remarquables   la production sait choisir ses acteurs ! "
5.0, Tout simplement exceptionnel. Le meilleur de tous les spider-man pour ma part. Ce que Marvel a réussi à réaliser dans ce chef-d'œuvre est impressionnant. Foncez !!! 
4.5," On prend un vrai plaisir à voir ce film qui comme Avengers endgame est un vrai film de fan service. Mention spéciale aux acteurs des anciens qui ont l air d avoir pris un plaisir fou a revenir, c est notamment grâce à ça que le film fonctionne. Maintenant attention à Marvel, pour que tout ça marche il faut aussi des vrais films avec leur propre histoire sans caméo, vivement donc d autres histoires et pourquoi pas avec différents Spiderman ( on a bien déjà celui des next génération et l actuel, vu son enthousiasme on verrait bien encore Andrew Garfield) "
3.0," Je vais faire bref . De belles scènes d'actions entre coupées de deux trois moments bien chiants et bien longs ou l'on voit que dans la salle que tout le monde s'ennuie . Le plaisir de revoir , ensemble , les 3 spiderman , les méchant ainsi que 2 les docteur strange . Les clins d'œil aux autres épisodes sont sympa, surtout pour les fans . Perso, je trouve tellement dommage que tout va soit gâché par ces deux trois scènes mal foutus qui coupent totalement le rythme ... Pas le meilleur spiderman mais un divertissement sympa. "
5.0," Littéralement Un Chef-d'oeuvre, pour moi ce spiderman est le meilleurs de tous, le rituel de docteur Strange qui tourne mal et qui ouvre des portes à d'autres mondes..  spoiler:  L'arrivée des ennemis légendaires et surtout de Tobey et d'Andrew juste INCROYABLE . Un film à voir si vous voulez avoir des frissons, des larmes et de l'émerveillement, tous ça en même temps ! "
3.5," Les fans de Marvel seront aux anges, les autres pourront tout de même apprécier le film. 3e film de la trilogie, et le meilleur sur son traitement du personnage, No Way Home est visuellement beau et les acteurs y sont convaincants. Même si les combats sont assez mal chorégraphiés dans l'ensemble et que le scénario est parfois simpliste, c'est avant tout un film de super-héros. La morale finale est tout de même intéressante et au vu de la fin, de nombreuses questions se posent sur les films à venir. Revoir tous ces anciens méchants est un plaisir même si c'est aussi du fan service, il ne faut pas le cacher. Certains personnages sont un peu mis de côté et on sent clairement que certains sont juste là pour faire plaisir aux fans. Mais ce personnage de Spiderman est bien travaillé et son évolution est à la fois logique et pertinente. Un bon point pour Marvel qui n'a pas toujours réussi à faire ainsi avec ses personnages. "
2.0," Très mauvais dialogues, scénarios bof, beaucoup de fan service. Malgré tout, Spider-Man reste un film distrayant qui a d'excellent acteurs (on pourra jamais enlever ça aux Marvel), quelques relations intéressantes entre certains personnages, notamment celle entre Peter Parker et Stephen Strange. Il y a aussi certains effets visuels intéressants, mais rien d'incroyable de ce côté-là, je m'attendais à mieux. Pareil pour les scènes d'action, c'est pas ouf. Un film vraiment moyen. "
1.0," Comment dire ? Scénario très moyen pour ne pas dire faible,visuellement moyen humour politiquement correct et souvent niveau 10 ans, réunion des méchants en forme de fin de cycle, … Tous cela comblera les enfants et les fans inconditionnel de la série Marvel, mais les cinéphiles trouveront le temps long (quasiment 2H30). "
5.0," Ce qu ils ont fait c est très très fort. On est pas dans le rassemblement d avenger a la Endgame, là, on est dans le fantasme de fan pur et dur. L attente etait longue mais c est noel avant l heure. Claque magistrale. J ai meme pas de mot tellement les trentenaires comme moi qu etais present au ciné pour le 1er spiderman on dû être en transe. "
5.0," Je ne peux décrire l'état de transcendance dans lequel, à un instant T, tout a basculé... Ce film est un bijou qu'il faudra assurément avoir dans sa vidéothèque personnelle. Le meilleur des 3 films avec Tom Holland. "
4.5, une tuerie .... un chef d'œuvre.... autant la nouvelle phase marvel partait assez moyennement alternant du bon Black Windows du moyen Shang shi du catastrophique mais beau visuellement the éternel que la ? niveau ascenseur émotionnel. on frôle le end game .... 
5.0," Le meilleur Spiderman réalisé, réservé aux fans et nostalgiques, avec un casting exceptionnel qui a su concrétisé les attentes de chacun. Une intrigue travaillée, des effets spéciaux a couper le souffle, tout cela accompagné d'émotions et d'humour comme nous savons l'apprécié dans un Spiderman. Un rêve devenu réalité ! "
5.0, Énorme !!!!!!!!!!!!!!!!!!!!!!!!!!!!!!!!!!!!!!!!!!!!!!!!!!!!!2 post générique qui annonce du très lourd en plus 
1.0," Je ne suis pas fan de la série ni de Spiderman, Mais vu l'engouement pour ce film j'y allais vraiment avec le cœur ouvert et de bonnes intentions… Je suis cinéphile et j'y vais en général au moins trois fois par semaine et j'aime voir tous les styles le cinéma. J'ai rarement autant regardé l'heure, trouvé un film long Et avoir eu autant autant envie de partir, J'ai tenu jusqu'au bout, mais quelle déception pour un film de cette envergure… Il n'y a aucune innovation pour un film de 2021 comparé à des Spiderman plus anciens, au contraire on ressort les vieux méchants les vieux Spidermans , on mélange tout et ça donne juste quelque chose de très indigeste, les dialogues sont gênants de lourdeurs à certains moments, les attaques de certains vilains sont tellement ridicules...Pour moi c'est un désastre d'ennui et comment comprendre l'engouement des fans et le remplissage des salles? Allez le voir et jugez par vous même j'ai envie de dire! Mais quel ennui! "
3.0," L’ARAIGNEE SE REFAIT UNE TOILEPour peu que l’on prenne le film pour ce qu’il est, c’est-à-dire un divertissement pour adolescent, tout va bien. L’action, l’humour, le fan service sont certes faciles, mais visent juste. Les effets spéciaux spectaculaires en mettent plein la vue et permettent d’oublier les incohérences du scénario. Le concept des multivers débride les imaginations mais, paradoxalement, au détriment de la créativité narrative. En effet, dans un univers où tout est possible, il est difficile d’éprouver de l’empathie pour des personnages à qui rien de bien méchant peut arriver. Vu le succès planétaire du film, Marvel et Sony ne sont en tout pas prêt d’abandonner l’araignée aux œufs d’or. "
1.0," Les personnes qui m'en ont parlé y sont allées parce qu'elles avaient peur d'être spoilées... je me suis persuadé d'aller le voir car j'avais été franchement déçu du dernier... ça a confirmé mes peurs... un acteur sans envergure qui joue particulièrement mal, un scénario vraiment nul, un Spiderman complètement gamin et perché, bref si vous pouvez passez votre chemin, ça n'en vaut absolument pas la peine ! "
4.5," Très bon film , divertissent avec une très bonne histoire et des effets spéciaux du plus belle effet . "
4.5," Un projet osé mais qui ne manque pas de bonnes idées. De bons dialogues et d'excellentes réparties. Spectaculaire visuellement, amusant, nostalgique.Hâte de le revoir. "
1.5," Je ne comprends ni la ""hype"" avant, ni la satisfaction du public après visionnage de ce film. Il ne s'agit que d'une production destinée au Fan Service. Visiblement, les gens manquent de discernement lorsqu'on leur donne ce qu'ils veulent voir... Je ne juge pas ceux qui ont aimé (chacun ses goûts), mais de là à dire que c'est le meilleur film de l'année et qu'il rivalise avec Avengers Infinity War/End Game, clairement NON...Il y a une grosse carence au niveau du scénario, beaucoup d'incohérences et un problème de rythme. Je ne m'étendrai pas sur la pauvreté des dialogues (certaines blagues étant parfois très lourdes et gênante)... Je noterai également une mise en scène peu inspirée et des décors fades, notamment pour la scène d'action finale. Bref, je n'ai pas apprécié ma scéance (je me suis laissé piègé par les premières critiques et la réaction à chaud des fans hordcore après la première projection), je ne comprends pas le bon accueil qui est réservé à ce film, et encore moins les résultats en salle... "
4.5," Un des plus gros film que j'attendais en cet fin d'année avec matrix et je suis vraiment pas decusspoiler : l'arrivée de Tobey ma fait frissone pour moi le meilleur des spider, evidamenet 2 scène Post générique dont la 2eme tease doctor Strange 2 on na hâte mais 2022 "
4.0," J'ai adoré l'introduction du concept du multivers qui se révèle être une véritable mise en abyme cinématographique, au même titre qu'un Last Action Hero ou Dans la Peau de John Malkovitch. L'histoire en elle-même est excellente avec un bon mélange d'humour, d'action et d'émotion, qui nous rappelle les grandes heures du MCU après un début de phase IV franchement très moyen. En revanche une révision des deux premières saga Spiderman (depuis les films de Sam Raimi) mais aussi du MCU en règle générale est quasi-nécessaire pour comprendre toutes les subtilités de cet opus. "
3.0," Je suis assez déçu par No Way Home, je l’ai vu il y a 10 jours et j’ai toujours du mal à digérer ce film. J’étais déjà déçu par Far From Home et je ne pensais pas que Marvel/Disney pourrait refaire les mêmes bourdes. Et bien si ! Il y a de très bonnes choses, mais chaque bonne scène, ou action ce mets en place avec des facilités. On dirait un scénario pour un dessin animé, pour un jeune public.Marvel/Disney doit (à mon avis) changer de réalisateur, Jon Watts n’est pas fait pour les films d’action, ni pour Spider-Man. Homecoming était prometteur, mais on a une trilogie bâclée et décevante.Sans vouloir ""spoiler""… À force de se servir de Spider-Man pour agrémenter le MCU, on perd Spider-Man ! "
5.0," après les multiples bande annonce de Sony concernant le film pour nous mettre la hype , je suis allez le voir hier au cinéma et bordellllll , le film a été un concentrée de nostalgie , de surprise , de moment fort , un péter qui as du faire des choix mais qui c'est vue aussi perdre des personnes au quelles il tenait beaucoup, un retour de plein d'anciens méchant en mode nostalgie qui ont fait plaisir , ainsi que 2 autres retour inattendu donc je ne spoilerai pas , bref un spiderman à la hauteur de nos attentes à nous les fans ,vivement la prochaine trilogie "
5.0," Génial! Je n'ai jamais vécu autant d'émotions au cinéma! On passe du rire aux pleurs, des pleurs aux rires, des rires aux pleurs...  spoiler:   sans compter la complicité avec le restant du public (des salves d'applaudissements à des moments clés).  . Je n'ai qu'une seule envie, y retourner tout de suite. On trouve de nombreuses références communes aux spidermans tels que  spoiler:   les acteurs (logique), les scènes de chute de la petite amie, et cette fameuse phrase"" un grand pouvoir implique de grandes responsabilités"" (qui malheureusement, quand elle est dite, pour les plus connaisseurs, est signe évident de la mort imminente de May, etc. Trop contente d'avoir revu d'anciens acteurs tels que Charlie Cox, Tobey Maguire, Andrew Garfield et tant d'autres...  . Tous les acteurs présents dans le film sont remarquables. Film à absolument aller voir. "
3.0," Clairement le Spider an avec Tom Holland comme acteur que je préfère, j'ai totalement oublié ce qu'il ce passe dans le premier, de vague souvenir du second volet qui était pas trop mal Du Fan Service à gogo qui m'a ravi.Le film est chargé de moment de joie intense et d'autre assez triste j'ai failli verser une larme pendant le film à cause de la musique.J'ai gros rire Par contre gros problème, c'est que le film n'a vraiment aucun putain d'intérêt, il ne devrait pas exister, c'est un non sens.Si un mec mets trop de sels dans son plat, il ne le mange pas, il le refait directement surtout qu'il s'en ai rendu compte.Je suis sorti en me disant tout ça pour ça.... "
