Note,Commentaire
3.5," Honnêtement j'ai bien aimé le film car beaucoup de nostalgie mais également beaucoup de fan service par rapport aux Spiderman de Tobey et Andrew, mais de manière objective je trouve ça scandaleux que des gens disent que c'est le meilleur film de super héros de tous les temps, le film est incroyable grace à la nostalgie qu'il apporte, mais le scénario, les décors, la qualité du film en général c'est vraiment bof. Le bouffon vert relève le film je trouve, une performance incroyable de Willem Dafoe malgré les années passées, mais franchement merci à la nostalgie pour relever le niveau. En se mettant dans la peau de quelqu'un qui n'a jamais vu la trilogie Raimi ou les TASM, on se rend compte que le film n'est pas exceptionnel. "
4.5," C’est un kiffe du début à la fin ! J’ai vraiment aimé , Tom Holland c’est retrouvé touchant , il est devenu vraiment bon ! De plus en plus bon au fil de la trilogie « home » du pur bonheur "
5.0, Quel bonheur de retrouver Tobey Maguire en spider man !! le rêve de bcp de fans je pense. on en prend plein la figure pendant tout le film. et les méchants ne sont pas si méchants au fond d'eux.. 
4.5," Ce film est un pur bonheur, tous les ingrédients d'un très bon film Spider-Man sont implantés dans un seul et même film. SPOILERS À VENIR !!!Beaucoup de fan-service, certe, mais pas mal de personnages dont on réclamait depuis longtemps leurs présences. Le retour de Tobey et Andrew, qui ne sont pas des caméos, font super plaisir, et les scènes de 'voltiges' redonnent une image parfaite d'un Spider-Man.Ce film est clairement, pour le moment, mon préféré par rapport à tous les autres films.Je recommande vivement d'aller le voir au cinéma, ne vous privez pas ce plaisir. "
5.0," Un film tout simplement fantastique! Le retour de personnages mythiques et tant attendus par le public, de très bons jeux d'acteurs, un scénario bien ficelé. Il y a 2 scènes post film. Cependant le film n'est pas meilleur qu'Endgame. Beaucoup d'émotion! "
5.0, Incroyable les trois spider man réuni et tout les méchants dans un meme monde les combats sont énormes. Les gens vont dire que Disney n'a plus d'idée donc il réunis les spider man mais perso je trouve ça génial 
5.0," Juste pas les mots, avant de le voir j'étais excité pendant un long moment, mais après d'avoir regardé le film, je suis sorti avec bouche ouverte, en cherchant les mots, tellement j'ai cherché je trouve pas... le film est incroyable, si j'ai l'occasion de retourner le voir, J'hésiterai pas une seconde. Merci Peter Parker. J'appellerai mon fils Peter. C'est écrit. "
4.5," Enfin un Marvel digne de ce nom... De l'action, de l'humour, du suspense. Bref, un régale de près de 2h45 "
4.0," Passé un très bon moment avec ce film. Scénario simple, mais efficace. Pas parfait, mais agréable à regarder. Des invités surprises qui font plaisir. Hâtr de voir la suite. "
4.5," Un vrai régal. Les fans avaient plusieurs attentes depuis plus de 2 ans. Et ces attentes sont plus que comblées.Certes, le film est un vrai modèle de fan service. Mais du fan service comme cela, bien maîtrisé et qui sert le propos, on en redemande !Certes le film n'est pas parfait et certaines ficelles sont trop grosses, mais quel kiff au global, si on sait garder en tête le sujet : le passage à l'âge adulte, magnifiquement traité.Tom Holland devient enfin Spider-Man, et il était temps ! "
1.5," /// SPOILER ///Bon.Je suis allé voir le film mercredi. Je dois dire que ça faisait plaisir de voir un tel engouement pour un film, franchement c'est rare. L'ambiance étaitsympa dans la salle avec des applaudissements à certains moments du film.Mis à part ça, ce film est une réelle insulte à tousles fans de Spiderman. Sincèrement, le scénario et la mise en scène sont franchement honteux. Le film prend tantôt un air faussement dramatique, avant de rajouter des moments d'humour mal venus, comme si le scénario ne suffisait pas à crédibiliser complètement le film.Le développement des personnages estcatastrophique. Tom Holland est montré en undébile sans cervelle qui pense à aider les autresavant tout... au point que ça en soit ridicule.Zendaya joue une adolescente niaise, et je parlepas du camarade complètement inutile au film.Bref, le seul argument de ce film, c'est littéralement le fan service. C'est d'ailleurs pour cela qu'on nous fait la fausse surprise d'avoir 3 spidermans. Super, c'est cool de revoir Tobey Maguire. Mais ça ne suffit pas à rattraper un film catastrophique qui s'inscrit dans la lignée des MCU depuis Avengers : des machines à sous.C'était bien la dernière fois que je me déplaçaispour un MCU. Je ne comprends pas l'engouement démesuré pour ce film qui se paye vraiment la tête des spectateurs. "
1.0," Très déçu de mon côté par cet opus de Spider-Man ; la raison principale étant qu’il est extrêmement mal écrit. Le scénario est digne d’un enfant de 5 ans et n’a aucune logique. On se retrouve à fustiger les protagonistes tout le long du film, notre tête entre les mains, tête que vous aurez rapidement envie de taper contre les murs.Alors oui la réalisation est là (c’est un point fort Marvel qui dispose des moyens nécessaires à ses montions), le casting est là (sans spoiler !!!!), le matériau qu’est le MCU est là mais tout cela ne suffit pas. Des interprétations creuses, du fan service ouvertement forcé, des enchaînements absolument illogiques, et un humour qui n’a plus rien de percutant. J’ai ris 2 fois sur 2h30 de film. C’est pourtant la patte de Marvel mais on sent pertinemment qu’ils ont du mal à s’adresser à leur public avec un héros aussi jeune.Le véritable problème de ce Spider-Man, c’est l’histoire. Le scénario a été écrit en 2 min montre en main:- Si Peter n’est pas stupide, le film dure 30 min. Ok, il est stupide.- Bon, si Steven Strange est sain d’esprit, le film durera 40 min. Ok, le docteur  spoiler:  sauveur de l’univers avec les Avengers dans Endgame  l’est devenu avec une perte totale de toute proportion. - Soit, si Tante May n’est pas elle aussi la pire des tordus , ça passera en 50 min. Et bim, encore raté. Les 2/3 du film semble être en trop tant la raison d’avancer est poussive et incongrue. Cela rend toute l’œuvre soporifique, incipide et sans enjeu malheureusement.  spoiler:  La fin du film en est d’ailleurs la preuve puisque Docteur Strange réglé le problème en lançant un simple sort, en 30 sec, et tout les compteurs sont remis à zéro. Pourquoi le film alors ? pourquoi le décès de tante May ? Pourquoi avoir exhumé les anciens super vilains ? Pourquoi courir avec un cube magique tralala qui ne servira jamais ? Tout ça pour une histoire d’admission post bac raté (avec les vieux et tout …).  Je conclurai ainsi : je n’attendais rien de ce film et je suis déçu quand même. "
5.0, Très bon film très bonne musique rien a dire les combats sont à couper le souffle les 3 Spiderman réuni c incroyable avec Ned qui devient le nouveau boufon vert à la pause crédite 
5.0," Probablement le meilleur Spiderman, toute franchise confondue. Quel bonheur de retrouver tous les acteurs de Spiderman des différentes franchises grâce au multiverse, avec un scénario cohérent. Tous les ingrédients Marvel sont réunis : humour et profonds sentiments de manière parfaitement équilibrée afin d'humaniser au maximum nos héros préférés. "
5.0," Franchement incroyable ! Tellement épique le retour de Tobey et Andrew, aux vus des rumeurs je m'attendais a ce qu'ils soient présent, mais franchement j'aurai jamais pensé les voir autant de temps dans le film ! Je crois que c'est la première fois ou je vais retourné voir un film au cinéma tellement j'ai pas digéré. "
4.5, ce spider man est éxcelent; il est très bien écrit il regroupe les 3 série de spider man depuis 2002. arriver a coordonée les 3 en meme et en plus le faire bien rend le film incroyable. il y a de l'humour de l'action et la fin est magique on ne peut que lacher ca petite larme.avec un tels budget il est de loing le meuilleurs film de l'année 2021.On attend evidament le prochain!! 
2.5," Fan service à gogo, scénario très moyen, beaucoup d'incohérences, pas de scène d'action marquante, humour mal géré. un film assez moyen.alors que j'avais plutôt apprécié les précédents opus. "
5.0," Ce film est franchement fabuleux, de l'action beaucoup d'attachement envers les personnages. Franchement incroyable ! "
4.5, excellent Marvel avec des rebondissements je suis très content d'avoir vue des personnages qui vont le succès de la franchise vivement la suite Marvel agrandit de plus en plus l'univers c'est génial avec un petit rappel à d'autres personnages 
5.0, Un film époustouflant rythmé émouvant touchant à regarder en famille et en ayant vu tous les autres SpidermanVraiment vraiment a voir Super mise en scène effets spéciaux au top bref un film Marvel… 
4.5," Malgré les rumeurs persistantes, les mini spoils ici et là, l'histoire a quand même réussi à me surprendre ! Quelques incohérences, quelques facilités scénaristiques, mais bon sang quel bon moment j'ai passé ! Je conseille ce film. "
5.0," la première moitié du film est déjà très bonne mais alors là deuxième, incroyable, ça fait vraiment plaisir "
5.0," Super film ! Rien à dire d'autre. Il m'a fais rêvée, voyager et puis même ému. Les meilleurs spider man de tout les temps ! Bravo à tout ceux qu'il on travaillée dessus ! "
5.0," [Critique avec SPOILERS] Spider-Man : No Way Home est un film qui est destiné en particulier au fan service, mais il reste quand même accessible à tout public. Cela faisait longtemps qu’on n'avait pas vu un tel engouement dans une salle de cinéma ; spoiler : l'arrivée de Tobey et Andrew a chauffée la salle ! Le trio enfin rassemblé après des mois de théories à propos de ceci, un rêve qui se réalise !Malgré toutes ces révélations faites avant la sortie du film, beaucoup de surprises inattendues viennent rajoutées du spectacle. Spoiler : la mort de May va sûrement pouvoir rendre Spider-Man (celui joué par Tom) plus mature, et donc avoir une ""nouvelle version"" de lui-même.Et les DEUX scènes post-générique ne sont pas à louper (message aux incultes qui ne restent pas jusqu’au bout).Bref, LE film à voir en cette fin d’année 2021 ;) "
3.0, Le film est bourré de defaults mais il réalise un rêve d'enfant et fait plaisir aux fans. On regrette cependant une paresse scenaristique et une mise en scène gerbante qui réduise le film au rang de Marvel sympa. Alors qu'avec ce l'ampleur du projet il aurait pu devenir culte. 
5.0, Incroyable rien a dire le meilleure filmeDu mcu j’annonce!!!! Époustouflant émouvant spectaculaire excellent jeu d’acteur 
5.0," Rien à dire si ce n'est que ce film est grandiose, les effets spéciaux sont vraiment bien faits, le retour des supers vilains nous a grave manquer.  spoiler:  Tobey Maguire et l'autre spiderman. Quel réel plaisir de les revoir, j'ai versé quelques larmes. Oui il faut le dire.   Pour moi chaque film spiderman était correct à suivre et le dernier n'y échappera pas non plus. 😍 "
4.0, Excellent film d'action/drame/comédie. Enfin un spiderman plus sombre et un acteur qu'on laisse s'exprimer ! Les moments de fan service sont un regal et pour une fois les moments triste ne sont pas stoppé par des blagues lourdes. Je l'ai vu hier en Imax VOSTFR et je compte bien aller le revoir en VF pour être sur de n'avoir rien raté. Dépêchez vous d'aller le voir ! 
2.5, C'est un divertissement visuellement réussi où l'incohérence domine tout le long. Idéal pour les enfants mais pour les adultes cela manque carrément de profondeur. Un Marvel comme tant d'autres qui n'apportent rien sauf un peu de nostalgie. [Spoil] Retrouvez Tobey Maguire fut un réel bonheur [Spoil] 
1.0," Un scenario mauvais, peter prend des decisions qui ne font aucun sens et chiale ensuite. Des dialogues nuls et malaisants entre les personnages saupoudrés de proverbes claques au sol. Jai perdu 2h30 de ma vie "
4.0," Ce troisième volet des aventures de Spiderman dans le MCU est incroyable.Un rêve sur grand écran !Le scénario est très bon et l'image est magnifique, certains plans sont juste fabuleux : Merci Dr Strange ! Cependant, j'aurais aimé voir des combats plus long et des séquences de ""Web-Swing"" plus nombreuses.L'utilisation du multivers, même si bien amené par Dr Strange, manque d'explication et il semble être facile d'ouvrir et fermer des portes sur d'autres univers.A ne pas mettre entre les mains de n'importe qui...L'humour lourd des films Marcel est toujours présent.Certains passages restent marquants et mémorables.Pour finir, il y'a tellement de références sur les autres films Spider-Man, à découvrir par vous même. "
4.0," Probablement le film le plus attendu de cette quatrième phase du MCU, l'ambitieux Spiderman No Way Home réussit à répondre aux attentes des fans. Malgré les différentes fuites autour du casting, le film offre une bonne dose de « fan-service » à la Avengers Endgame et tout comme celui-ci Marvel nous livre un très bon film qui aurait cependant pu être meilleur. La force du film réside dans ces personnages et les liens qu'ils entretiennent ensemble. Le Spiderman interprété par Tom Holland livre une belle performance touchante et attendrissante. Le ton plus dramatique de ce troisième film offre une nouvelle perceptive pour l'avenir du personnage dans le MCU. La présence de Dr Strange est bien dosé et le personnage garde le caractère qu'on lui connaît depuis le premier Dr Strange tout en offrant une belle ouverture pour le deuxième film attendu pour 2022. Malheureusement, le film n'a pas de réel fils conducteurs contrairement à Avengers Endgame qui suivait les évènements du précèdent volet. La présence de certains personnages est sans intérêt ainsi la première demie-heure du film est complètement oubliable. On pourrait regretter l'aspect un peu brouillon de certaines scènes notamment dans les combats pourtant très sympathique. Quant à l'humour, bête noir des films du MCU, celui-ci est très bon malgré quelques gags qui restent en suspend. Spiderman No Way Home gravera sans aucun doute le MCU par un film qui a su répondre aux attentes en offrant un film spectaculaire et touchant. Marvel avance dans cette phase 4 avec un univers et des personnages bien plus humain, riche et sombre que ces précédentes phases une nouvelle fois confirmer par ce film. "
5.0," Que dire ? Un pur chef-d’œuvre ! Des effets spéciaux vraiment splendide. 2h30 de film qui passe sans qu’on s’en rende compte. Quel nostalgie… spoiler:   Revoir ces 3 Spiderman, revoir Tobey, qui aurais cru cela possible ?  Bien évidement je recommande à 100% au fan de Marvel ! Au top ! "
3.5," Ce film est super mais ne vaut pas les « chef d’œuvre » « magique » « un succès ». Le début du film est vraiment long. Top Holland incarne un spider man niais, cucu, un peu benêt. Les dialogues du début du film sont vides sans intérêt, les scènes d’action sont fades.  spoiler:  Seule la dernière scènes avec les 3 Spiderman était cool . Ils ont absolument tout misé sur les deux anciens spiderman et les autres méchants, mais le scénario reste VIDE. Mais ce film reste quand même bien, le passage de doctor strange, les effets spéciaux sont vraiment fou ! Ce film ne se base que sur l’argent qu’il va rapporter… c’est bien dommages car il ne reflète pas le succès des autres Spiderman! "
5.0," Je peux mourir en paix !! Voir tout ça, c'est tout simplement INCROYABLE ! Tout est présent pour être le film Spider-Man ULTIME. Il me tarde d'avoir les annonces des Funko Pop... FONCEZ le voir, car c'est notre pouvoir, et un grand pouvoir implique de grandes responsabilités! "
2.0," J'avais décidé dans un premier temps de voir un film ""sérieux"" au Rialto. Et puis suis tombé sur le banner de Spider Man et je suis aller derrière l'illusion des effets spéciaux et d'une histoire simple avec le méchant et le gentil qu'a la fin gagne. Qu'est ce que j'ai regretté, je me suis retrouvé face à trois ados protagonistes du film ( y compris Spider Man) et des histoires pathétique. 2h et demie d' ennui. "
5.0," Le film est incroyable, beaucoup d'émotions en voyant certaines scène ou avec certaines répliques, je pense que les plus jeunes vont aimer mais qu'elle dommage si ils n'ont pas toutes références "
5.0," Merci pour les émotions. Très généreux en tout. Nostalgie, tristesse, joie, adrénaline, déchirement... Si vous aviez votre petite larme à la fin d'Endgame, vous pleurez de déchirement dans celui-ci. "
1.0," Beaucoup trop de niaiserie dans ce films... Peter Parker trop déçu de pas être accepté au MIT avec ses petits potes, demande à Dr.Strange de lancer un sort qui bouleverse le monde et aboutit à la mort de tante May. Peter Parker ne peutt accepter le regard des autres, est recalé du MIT mais est capable de trouver en une nuit les remèdes pour contrôler l'IA (Docteur Octopus), l'électricité (Electro), la schizophrénie (le Bouffon Vert), un agent mutagène (le Lézard).Marvel ne fait pas de films de super-héros mais de super-égo(centriques). "
4.0," Excellent spiderman, Accrochez vous ça va vite dans les hauteurs de New York, avec une multitude de rebondissements...Le meilleur de la franchise Tom Holland avec une Zendaya resplendissante ,J'en dis pas plus , amusez vous bien "
5.0, Un grand respect un hommage a l univers de spider man Tous les personnages sont bien utilisés Un bon marvel et le seul de l année en plus ^^ 
3.0," SURPRENANT ! C'est le mot qui pour moi caractérise au mieux ce film... Surprenant mais en un point : Trois acteurs réunis dont deux qui nous ont fait rêvé depuis que l'on est gamins, c'est pas tous les jours que l'on voit ça et il est impossible de masquez un sourire en coins lors de cette scène mythique. Et cette idée concrétiser mérite à elle même deux étoiles!Oui parce que sans cela, le film se résumerais pour ma part à une simple étoile et pourtant Dieu sait à quel point j'adore Spider-Man!Pourquoi cela ? Une histoire beaucoup trop simple et tiré du chapeau, on s'attendait à un scénario bcp plus travaillé le MCU m'a déçu sur ce point, une absence totale de blagues pour le héros de l'ironie et des petits mots Taquins en pleins combats, je vous avoue que c à manque... et puis un acteur principal vraiment pas à la hauteur des anciens et ce film ne fait que confirmer ce propos.Un bon moment tout de même. "
5.0, L’un des meilleurs Marvel a mes yeux. Il est juste époustouflant ! Je vous conseil fortement d’aller le voir en 4 DX 
5.0, Tout simplement magnifiques  spoiler:  les gens qui étaient tous a fond sur les retour de Tobey et Andrew  plus le rappelle de tout les anciens méchant ect franchement c'est le film qui dépasse toute excellence l'heure et passer tellement vite 
5.0," Une vraie Masterclass, un scénario original mieux écrit que les deux premiers Spider-Man avec Tom Holland, une relation entre Zendaya et Tom Holland bien mise en scène. Vous allez adorer ce film ! "
4.0, Très bon film qui a su prendre l'ensemble de la salle du début à la fin. La finesse du scénario et l'excellent jeu d'acteur de Tom Holland permettent la réalisation du meilleur film fantastique de l'année.La nostalgie nous emporte pour ce dernier opus signé Jon Watts. A allez voir au plus vite ! 
4.0," Bon alors ce n'est pas le dernier des Spiderman, mais je suis bien content de retrouver les 3 acteurs mais cel qui aurait été encore mieux, c'est de voir aussi le premier Spiderman joué dans les années 60 par Nicholas Hammond. Ah la jeunesse.... Je suis bien déçu que le réalisateur n'est pas fait un clin d'oeil à cet acteur de 70 ans. "
5.0," La fin d'une trilogie spectaculaire, les effets spéciaux sont à couper le souffle, le panel d'acteurs est incroyable ! Marvel nous fait voyager dans le monde de Spider-man une nouvelle fois et c'est un succès ! Un grand bravo "
5.0," Ce film est juste incroyable, les effets spéciaux sont excellents et tom holland joue très bien, un truc que j'ai beaucoup aimé dans ce film, c'est le bouffon vert, ils ont essayé de le faire à la comics et c'est vraiment, par contre je pense que l'acteur de l'homme sable n'a pas joué dans ce film car les seuls fois où on le voit sans le sable, ce sont des images de spiderman 3 de Sam Raimi. Bref, film à ne pas manquer, et les gens qui ont mis 1 étoile, je ne les comprends pas 😕 "
4.0, Juste un énorme kiff de voir les 3 générations réunies dans un final grandiose. Un metaverse porté à la perfection sur le grand écran. On aimerai juste voir un petit peu plus Spiderman torse nu ;) 
5.0, Juste ENOOOOORRRME !Un vrai cadeau de Noël pour tous les FANS qui ont grandis avec Spidey !!!Le meilleur de la trilogie 
4.5," Très bon film, ENFIN un bon film pour ce Spider-Man ! ENFIN réconcilié avec Tom Holland. Un premier opus : Spider-Man Homecoming ennuyant et niant niant, film pour adolescent Un deuxième Opus : où Tony Stark est la pour booster les ventes et faire le babysitter, moyen sans plus.Un troisième Opus où au final il n'y a rien a re dire, c'est un chef d'œuvre!  spoiler:   C'est tellement JOUISSIF de voir ce '' Norman Osborn '', quelle talent, quel génie ! Ce bon vieux Wilem Dafoe qui a insisté à 66 ans pour faire ces cascades lui même! Et que dire quand les deux autres Spider-Man apparaissent à l'écran. Sous une pluie d'applaudissement au cinéma! et Oui Monsieur on applaudie bien fort Tobby et Andrew. (Je fais genre, mais ça m'a surpris)  Le réalisateur fais un sans faute, l'introduction de tous ces personnages sont incroyable, toujours dans le bon Timing. L'humour pas trop surchargé. ENFIN du sang dans ce Spider-man mi Disney mi Sony.C'est rarissime que je voie un film à nouveau, mais là je vous envie que je me laisserai bien tenté!Les clin d'œil sont juste incroyables, il y a pour tout le monde.Jon Watts à réussi un bon film sur trois, BRAVO ! Comme quoi il faut deux brouillons pour un chef d'oeuvre.On dit jamais deux sans trois? On espère tellement voir un The Amazing Spider-Man 3 !!!!!! "
3.5," Si la première partie  spoiler:  jusqu'au moment ou les méchants s'échappent  est très largement oubliable et assez longue par moment, le film trouve son intérêt dans sa deuxième moitié ou les enjeux dramatiques sont bien présents. La déferlante d'effets spéciaux en fait un spectacle jouissif et surement le meilleur épisode de la trilogie.On regrettera cependant que la fin soit un peu bâclée  spoiler:  car le duel entre Spiderman fou de rage et un Willem Defoe toujours aussi bon aurait pu aller dans des sphères beaucoup plus dramatiques. Malgré ces défauts, armez vous de patience pour passer la première heure et le spectacle en vaudra largement la chandelle. "
5.0, Époustouflant tant les acteurs que les réalisateurs.Ce troisième volume m’a rendu émerveillé et certaines scènes m’ont ému de tristesse mais aussi de joie 
5.0," Fantastique, génial, grandiose, surprenant, amusant, triste il est tout à la fois. C’est le film à ne pas manquer ni se faire spoiler ❤️😊 "
3.5, Super film d'action avec beaucoup de nostalgie quand on voit spoil avec spoil L'ambiance dans la salle était démentielle 
5.0," Très bon films avec pleins d'émotions, pour les fans de spider-man toutes génération à aller voir🙏😁 "
5.0, Du fan service à gogo. un bon film bourré de références au 2 premiers spider. pour moi rien ne vaudra jamais la première trilogie et finalement ce film nous le rappel bien. 
5.0," Ceci est un chef-d'œuvre incroyable, j'ai vraiment adoré regarder ce film et en plus la fin est vraiment épique et époustouflant pour nos yeux. "
2.0, Un film très décevant sur bien des points. commençons par parler du personnage de Peter Parker qui n'évolue pas. Toujours à l'origine de l'intrigue de par ses erreurs. Un film beaucoup trop long qui part dans tous les sens. Le choix des personnages est incohérents. Il y a beaucoup trop d'humour placé dans des endroits non adéquats. Enfin on atteint le summum du fan service dans une histoire sans saveur. 
5.0," Incroyable performance sur un film d'un super héros solo, les effets spéciaux, le casting, la narration, ils dépassent tout les films Marvel jusqu'à maintenant "
5.0," Je viens de voir le film, il est bon, réducteur comme commentaire mais c'est un fait. J'ai passé un agréable moment devant tant de retour d'acteurs au niveau du casting. Mes standards en exigence cinématographique n'en demande pas plus pour un film de super héros et heureusement pour moi comparé à certains lol. "
1.5," Catastrophique. Blague sur blagues, zéro tension dramaturgique, les acteurs se demandent ce qu'ils foutent là (en même temps comment leur en vouloir vu la piètre qualité d'écriture), les méchants iconiques sont devenus de véritables clown sous la direction de Watts. Ils sont la pour balancer des vannes et faire rire le spectateur, c'est pitoyable. Seul Dafoe s'en sort avec les honneurs et encore, pas toujours. Ça conclue une trilogie ratée et l'aspect nostalgie n'aura pas suffit à me faire apprécier ce film. Avis subjectif évidemment. "
5.0," Dynamique et explosif du début à la fin, ce nouveau long-métrage aura l’ambition de nous faire voyager dans l’univers de notre araignée préférée. Un Tom Holland vraiment très bon, surtout dans le dernier tiers. "
