Note,Commentaire
5.0, le trailer est magnifique ce qui ma donné le courage de publier ce commentaire dans tous les cas moi je fais confiance tom holland et les acteursPs:je suis un 2010 j'ai 11 ans merci de ne pas m'insulté 
4.0," Il est évident que les auteurs ont vu, envié puis se sont inspirés du succès mérité et si jouissif du film d'animation ""Spider-Man : New Generation"" (2018), le multiverse évidemment, mais surtout dans plusieurs clins d'oeil (un spider-man noir ?!) et à une mise en scène encore plus folle et inventive qu'on remarque surtout à 3-4 passages marquants du film. Le plus impressionnant est que personne est laissé pour compte ou sous-exploité. Une gageure à saluer, surtout que ce soin appporté aux personnages n'entame en rien la construction narrative. Le mix action-humour fonctionne à merveille et arrive à son comble dans une second partie qui offre son lot de surprises ; ou plutôt ce qui est si attendu arrive avec classe et gourmandise, cela annonce une dernière partie assez démente et si icônique qu'on pardonne quelques longueurs et des références trop appuyées. Le plus gênant est justement la toute fin, trop tirée en longueur, on frôle le pathos et le trop bavard, sans compter ce générique de fin peu créatif avec une chanson oubliable. Ca reste un très bon moment à voir, à revoir et à conseiller.Site : Selenie "
4.0," L’idée était alléchante et relevait presque du jamais vu... Mais elle était sacrément risquée. On aurait pu frôler l’indigestion ou faire face à un micmac narratif sans queue ni tête. Mais c’était sans compter sur les têtes pensantes du Marvel Cinematic Universe qui l’ont fait et on ne peut dire qu’une chose : c’est plus que réussi! Bien plus jubilatoire que le raté « Justice League » et tout aussi jouissif que les différents épisodes des « Avengers », le MCU connaît la recette des réunions de super-héros. Mais ici, c’est encore autre chose puisqu’on entre dans ce fameux multivers tant attendu. Si dans les comics cela passe sans accrocs, à l’écran c’est tout autre chose. Cela pouvait sembler téméraire, mais le script parvient à faire rentrer les trois sagas dans un seul film de deux heures et trente minutes d’une manière si simple et limpide que cela confine au génie. Bien sûr il fallait que tous les intervenants des trois sagas soient partants et c’est le cas. On peut en parler sans déflorer des secrets de polichinelle avoués à grand renfort de marketing, mais qu’il est plaisant de retrouver trois générations de Peter Parker sur la grande toile. C’en est presque émouvant et cela fait remonter une certaine nostalgie qui nous surprend. Idem pour les vilains de la saga quasiment tous réunis, et qu’il est original et notable de voir que, pour une fois, il ne faut pas les anéantir mais les sauver. Belle idée! Ce « Spider-Man, no way home » s’apparente presque au « Sinister Six » avorté de Sony qui devait réunir, à la manière d’un « Suicide Squad », les méchants iconiques de l’univers de Spidey. Ici on a donc une sorte de buffet royal majestueux, généreux et maîtrisé d’un personnage et de ses différentes itérations. Un best of en quelque sorte mais qui ne se contente pas de faire du fan service (même si celui-ci est fort présent).En effet, on ne compte pas les clins d’œil et les références à toute une génération de spectateurs, mais au MCU également. On sent que ce film avait une importance énorme pour le futur de cet univers au succès devenu incontournable, qu’on l’aime ou qu’on ne l’aime pas. Et les fans sont servis sans que cela fasse forcé tandis que les autres ne feront pas forcément attention et prendront leur pied quand même. On regrettera juste un petit ventre mou avant le final ainsi que ledit final, impressionnant mais encore une fois dans le noir et en pleine ville. Depuis le magnifique « Les Éternels », on a envie de voir des lieux de combats un peu différents. Mais Spider-Man reste un héros citadin alors... Enfin, le fait de prendre le Bouffon vert (encore) comme vilain principal n’est pas le meilleur choix mais cela reste personnel. Octopus ou le Lézard étaient plus réussis. Hormis ces minuscules réserves, c’est un plaisir de gamin de chaque instant. « Spider-Man, no way home » est émouvant, drôle et rythmé au possible. Jon Watts commence à connaître la chanson et livre le meilleur opus des trois de sa saga et, surtout, il confirme que Tom Holland est clairement la meilleure incarnation du super-héros. L’acteur est vraiment bon tout comme son amoureuse à l’écran Zendaya. Enfin comment ne pas saluer la qualité d’effets spéciaux sidérants. Pas le meilleur film de super-héros de tous les temps certes, ni du MCU, mais un pari réussi et un sacré pot-pourri du meilleur de l’univers Spider-Man. Bravo!Plus de critiques cinéma sur ma page Facebook Ciné Ma Passion. "
3.0," Suite directe du ""Spider-Man: Far From Home"" de 2019, ce nouveau Marvel nous propose un Peter Parker démasqué aux yeux du monde.Devenu vulnérable et fugitif, il va demander de l'aide au Docteur Strange.Celui-ci va tenter de lancer un sort qui fera oublier à la Terre entière l'identité de notre super-héros araignée, il va malencontreusement déclencher une réaction en chaîne multidimensionnelle quasi incontrôlable !J'ai eu un peu de mal à suivre cet opus totalement dédié aux fans de tous les épisodes Spider-Man tournés depuis le début des années 2000.Je ne maîtrise pas assez la saga, comportant à ce jour 3 comédiens différents (Tobey Maguire, Andrew Garfield et Tom Holland), pour pouvoir apprécier toute la plénitude de ce volet semblant fêter les 20 ans de ce super-gamin tissant des toiles en tous genres !L'action reste cependant ébouriffante, même si le scénario n'offre pas une réelle profondeur et tourne rapidement en rond.Un beau film en forme d'hommage qui plaira aux amateurs : de belles surprises en perspective pour eux !Site CINEMADOURG.free.fr "
4.5," Tous les ingrédients d'un bon spidey sont réunis : de l'action, de l'adolescence naïve, de l'idéalisme, de la vaillance, du drame personnel, de grands pouvoirs et les responsabilités qui vont avec...Et cette fois-ci, on y ajoute de l'absence, de la mélancolie, de la nostalgie...Très ruche visuellement et malin scenaristiquement. A voir pour se donner aussi l'envie de revoir tous les autres opus "
4.0," Un nouveau Spider-Man qui tient enfin toutes ses promesses ! Action, émotion ... et son lot de surprises ! "
4.0," Conclusion plus qu’attendue de cette trilogie sur l’homme-araignée incarné par Tom HOLLAND, « Spider-Man : No Way Home » possède à la fois du cœur et de l’âme. Bourré d’actions et d’effets spéciaux digne d’un « Avengers : Endgame », le film constitue un véritable bouquet final éclatant, comme il se doit. Le casting est incroyable : pour ceux qui ont grandi avec Alfred MOLINA et Willem DAFOE en Docteur Octopus et Bouffon Vert, c’est un choc générationnel jouissif. C’est exaltant, épique et profondément émouvant. L’émotion l’emporte vraiment sur l’humour d’un traditionnel film Marvel.En somme, le nouveau volet du personnage le plus célèbre de la saga de l’univers Marvel tient totalement ses promesses. C'est un bel hommage à l'univers de Spider-Man, un cadeau de Noël grandiose pour des générations de fans. "
4.0," Un excellent film spectacle popcorn qui remplit son rôle de satisfaire les geeks fan que nous sommes de Spiderman. Nombres références à tous les films MARVEL précédents. Mais il demeure toujours cet effet MARVEL : l'impression de voir un gros épisode couteux d'une longue série . Chaque phase ressemble à une saison. Il manque le souffle d'inspiration, et d'originalité qu'avait les Raimi / Donner / Burton et même Nolan. "
3.5," Je suis partagé entre le fan service qui fait très bien le job et un scénario complètement nul . Il y a beaucoup d'incohérences et des dialogues très mal écrits. Ça fait le job mais franchement, rien de fou . DU FAN service et rien d'autre . "
4.5," Le film que j'attendais et que beaucoup de monde attendaient est enfin arrivé depuis Mercredi !!! Je l'ai trouvé vraiment excellent mais loin d'être parfait. Les acteurs sont excellents, la nostalgie est totalement présentes avec la présences des anciens méchants, les effets spéciaux sont très bien réalisés, la mise en scène est assez soigné et la musique est bien.  spoiler:  Par contre, je trouve que certains méchants sont assez mal fait notamment le visage du lézard, je n'ai pas retrouvé le même visage du lézard qu'était dans The Amazing Spider-man. De plus, j'ai trouvé que le changement de costume et de couleur de Electro n'est pas du tout expliqué ou alors vite fait . Une histoire assez sombre mais quand même avec de l'humour, de l'action, des combats bien chorégraphiés.  spoiler:  Je ne m'attendais pas du tout à la mort de Tante May. Je n'ai pas compris aussi pourquoi l'homme sable ne s'est jamais dévoilé en forme humaine à part à la fin. J'aurais bien voulu voir des flashbacks de la mort de l'homme sable et du lézard parce que dans mes souvenirs, je crois qu'ils ne sont pas morts à la fin de leurs films dans lesquels ils apparaissent.  Bref, malgré tout ce que j'ai évoqué, j'ai quand même beaucoup aimé ce long métrage. Ça valait quand même le coup d'attendre au vue du résultat. Bref, un excellent film que je vous conseillerais d'aller voir. "
3.0," Encore une fois Disney propose un film qui joue énormément sur la nostalgie des spectateurs créant chez eux un manque cruel d'objectivité. Ce film avait beaucoup de potentiel mais n'a pas su s'en servir à bon escient.Les méchants sont très mal exploité (sauf le Green goblin), les chorégraphies sont d'un bas de gamme assez déconcertant et les dialogues sont très pauvres.Sans parler de la bande originale qui aurait pu être d'une grande source de nostalgie mais qui, encore une fois, n'a pas été au bout des choses. spoiler:  Enfin, l'arrivée des deux spideys fait sur le ton de l'humour façon Disney gâche encore plus une scène qui aurait pu être mythique. Nos deux super-héros seront uniquement résumé à parler de leurs toiles et faire des blagues que l'on oubliera quelque minutes plus tard en sortie de séance. Le point positif du film est cependant la grande avancée morale de Peter Parker (Tom Holland) qui joue très bien et de mieux en mieux son rôle.  spoiler:  La mort de tante may est aussi un moment clé que j'ai trouvé particulièrement bien réussi et touchant.  Enfin bon, je met 12 car sur 5 étoiles difficile de pencher sur le 14 que le film ne mérite pas, John watts nous propose encore un bon divertissement mais sans aucune réelle saveur avec des personnages emblématiques mais lisse comme la toile.. "
5.0," Le film de la maturité, et surtout le film donnant une dimension folle à cette phase post Endgame ! Merci à Sony et disney de nous faire rêver. Une claque du début à la fin. Restez à la 2eme scène post générique. Ça vaut le coup. "
5.0," C'est tout simplement le meilleur Spiderman de tout les temps ! L'un des meilleurs Marvel ...bref chef d'œuvre dans son style .Drôle, émouvant, épique ,les effets spéciaux et l'histoire sont incroyable "
3.5," Une dimension dramatique, des méchants (de retour) charismatiques, des scènes d'action fortes et un scénario loin d'être extraordinaire mais qui au moins se débarrasse du ridicule des deux premiers opus : il fallait bien tout ça pour donner au Spider-Man de Tom Holland un minimum d'intérêt.""Spider-Man : Far From Home"" est ce que j'appelle un film de super-héros efficace qui utilise à bon escient tous les ingrédients nécessaires à la création d'un blockbuster divertissant. Contrairement aux deux premiers films, cet épisode prend un ton beaucoup plus grave où Spider-Man est enfin (réellement) dépassé par les événements. C'est donc une satisfaction en tant qu'adepte du personnage présenté sous la houlette de Sam Raimi de voir des enjeux dignes de ce nom pour Tom Holland. Malgré tout, ""Far From Home"" souffre comme ses prédécesseurs d'un trop grand nombre de passages risibles qui nous font légèrement sortir du film. L'écriture n'est pas mauvaise en soi et vous me direz que ce côté un peu grotesque a toujours fait partie du personnage de Spider-Man, mais cela transparait de façon un peu plus artificielle dans cette trilogie. spoiler:  Évidemment, il est impossible de faire une critique de ce film sans évoquer le grand retour des méchants des années 2000 et de ceux de l'Amazing Spider-Man. Et et et... la présence de Tobey et Andrew qui n'est d'ailleurs plus une surprise tant il a été compliqué de le cacher pendant la promotion du film. Je dois dire que j'appréhendais ce retour, eh bien c'est finalement rondement mené. Après des premières apparitions un peu laborieuses mais toujours dans l'esprit du personnage, leurs jeux d'acteur respectifs sont touchants et équilibrés. Ils apportent à l'intrigue, juste après la mort de tante May, toute la dimension dramatique que l'on attendait depuis le lancement de la franchise en 2017. On peut donc chaleureusement remercier le multiverse ! C'est beau de les voir réunis et bien qu'Andrew Garfield soit quelque peu dégoûté de son rôle dans l'Amazing, c'est une sorte de revanche pour lui et des petits clins d'œil pourront sans doute le réconcilier avec lui-même et les fans blasés de sa duologie. Bien joué Marvel. On aura beau parler de fan service (de toute façon oui c'est clairement assumé bien que le multiverse soit annoncé depuis ""Loki""), ça n'entache rien au cheminement de l'histoire, au contraire. C'est bien amené. Alors certes si vous n'êtes pas un fin connaisseur des films précédents vous n'aurez pas toutes les références... toujours aller au cinéma en connaissance de cause n'est-ce pas.  spoiler:  Côté méchants, c'est également un plaisir de les revoir ! Ils n'ont pas tous la place espérée mais ils sont tout de même respectés et chaque acteur revient tel que dans les versions antérieures.  Pour conclure, ce côté un peu lourdingue par moment (le coup des ""grandes responsabilités..."" par exemple) est gommé par un casting et des enjeux à la hauteur de l'événement. Comme prévu, le multiverse ""sauve"" quelque peu cette trilogie et l'empêche de se saborder complètement. "
3.0," L'idée générale me paraissait intéressante. Les bandes annonces m'avaient bien motivées, même si je percevais déjà un peu les dangers. Et quelle déception...Les points positifs : - Tom Holland est à un très haut niveau en jeu d'acteur. Drôle, touchant, vraiment à fond. - L'introduction du Multivers est plutôt réussie- Les scènes d'action sont époustouflantes, très belle réalisation clairement. Les effets spéciaux sont magnifiques. - La construction de Spiderman dans ce volet est très réussie je trouve. On voit bien le cheminement de Peter.- Très heureux de voir le meilleur personnage Marvel rejoindre le MCU !  spoiler:  (Daredevil) - Agréable aussi de voir revenir les anciens ""vilains""  spoiler:  ainsi que les autres Peter Parker bien que ça ait des points négatifs aussi...  -  spoiler:  Voir Andrew sauver MJ est l'une des meilleures scènes du MCU.  Les points négatifs : - Le scénario, très clairement. C'est très niais, bon certes ça reste un film de superhéros, mais quand même... J'y trouve plusieurs points très gênants. D'abord Dr. Strange est d'une faiblesse... Donc celui qui peut rivaliser easy avec Thanos est incapable de foutre à terre un gamin ? Pourquoi pas. Deuxième chose, les facilités scénaristiques qui sont poussées à l'extrême :  spoiler:  Peter Parker a trouvé un moyen en laboratoire pour que les méchants deviennent des gentils . Bon du coup, est-ce utile de continuer les films du genre ? On peut trouver un antidote pour tout le monde... - Les incohérences très marquées :  spoiler:  Ned arrive à ouvrir des portails easy, alors que le premier film Dr Strange nous a montré que ça prenait des heures et des heures d'entrainement intensifs ;  spoiler:  Les vilains racontent qu'ils sont arrivés dans cet univers au moment où ils mourraient (déjà... pourquoi?), c'est étrange car ils ne sont en aucun cas morts sur une même timeline ;  spoiler:  A la fin, Strange repousse les nouveaux arrivants : étrange, pourquoi ne sont-ils pas arrivés en même temps que tous les autres ? ;  spoiler:  Le sort final qui fait oublier à tout le monde que Spiderman est Peter Parker, là encore, bizarre, la première fois Strange disait qu'il était tout à fait possible d'exclure qqls personnes (le sort avait dysfonctionné à cause des interventions incessantes de Peter) ; - Ce qui aurait du être le point fort du film est en réalité un de ses points faibles :  spoiler:  les trois Peter. Bien sûr c'et génial de tous les voir à l'écran. Mais la manière dont ils sont introduit est à la fois cool et super lourde. Cool avec les portails. Lourde avec la tante ou grand-mère de Ned, un peu pénible. L'alchimie entre les trois ne fonctionne pas tant que ça. Je suis fan des deux premières franchises et là je trouve que ça a un peu cassé les traits de ces personnages. Les Peter d'Andrew Garfield est censé être plutôt brisé. On le voit pas tant que ça... Bref j'ai trouvé ça plutôt laborieux. Enorme frayeur quand j'ai cru qu'ils avaient tué le Spiderman de Tobey.......  - Les musiques. Enorme point faible. A l'exception d'une ou deux musiques émouvantes, on est quand même à des années lumières d'une production comme celle de Dune par exemple ou films DC. Il parait qu'alors que le tournage était déjà bien avancé, les réalisateurs n'avaient pas encore trop travaillé la fin du film. Et ça se voit. Du fan-service en veux-tu en voilà (ce qui explique les notes et les critiques exceptionnelles), mais quand on gratte un peu, le scénario est vraiment faible, incohérent, et niais. Un bon divertissement. Pas un grand film. Déception "
5.0," Ce film était exceptionnel franchement ça a réalisé le rêve des fans des Spiderman et le scénario, tout était top "
2.0," Exception faite des premières scènes d'action particulièrement réussies, avec des effets spéciaux à la hauteur d'un rendez-vous MARVEL, le reste du film verse dans l'inconcevable, l'absurde, le burlesque et le pleurnichardisme... D'autant plus regrettable que les acteurs répondent tous présents : hélas, pas les scénaristes !!! Une grande déception, synonyme de mortel ennui... Pour les inconditionnels du genre, et du traitement... "
1.5," alors par quoi commencer ???j'ai 34 ans et je le trouve beaucoup trop enfantin, une histoire sans queue ni tête, vous me diriez que c'est un film spiderman faut laisser passer le temps et se prendre au jeu, mais ça n'accroche absolument pas.mettre un pacquer d'argent sur les effets spéciaux qui donnent mal de tête sans penser une fois à l'histoire et le scénario c'est navrant comment dénaturer un mythe, détruire l'un des meilleurs personnages de marvel ??? bin regarder ce film je ne comprend pas tout ces avis positifs qu'on lui attribue mais objectivement je suis sorti déçu de la séance "
0.5," Je ne met que rarement des critiques mais je ne peux pas laisser une note aussi haute pour un film aussi banal. Qu'est ce qui rend ce film si génial ? Le scénario ? Aurait pu être écris par mon frère de 8 ans, sérieusement il n'y a pas une scène où on se demande pas ""mais pourquoi ils font ça ?"".  spoiler:  Comment par exemple Spider man peut-il mettre en péril la vie de centaines de personnes pour les ""soigner"" et leur éviter la mort tout ça pour les soigner (miraculeusement ptdr) et les renvoyer dans leur dimension où ils vont vraisemblablement... mourir 😭 . Les personnages ? On les connaît déjà tous, 0 surprise mais alors leur utilisation 🥶.  spoiler:  Déjà qu'est ce que c'est que cette utilisation de Tobey et Andrew ?? Leur arrivée est R-I-D-I-C-U-L-E, ils n'ont même pas l'air humain. La salle à hurlé à leur arrivée et c'est là que j'ai compris. Peu importe la manière dont ils sont introduits vous auriez été heureux. La vérité c'est qu'il n'y a rien d'iconique à leur retour . La musique ? Baclée et oubliable. Alors allez y, osez me sortir une scène iconique de ce film ? Osez me dire quelle scène restera dans l'histoire ? Il n'y en a pas. Ce film, comme les 2 derniers spider man, sera oublié vite et n'aura jamais l'impact digne d'un grand film. "
4.5, Ouaw Ouaw Ouaw !!!! Truc de ouf ! super film incroyable on voit pas le temps passer quelque scène sont drôles et effet spéciaux réussi. Foncez le voir on passe une excellent moment et clairement on voit pas les 2h30 passer c'est plutôt bon signe Beaucoup de rebondissement.En gros : bon acteurs rythme RAS visuellement super.L'idée de remettre les anciens acteurs des anciens spider man est top .Dans la salle beaucoup de réactions positive. Les gens ont même applaudi a la fin 
3.5," Un bon film avec de bons moments mais par contre le scénario me laisse perplexe.Quoi sérieusement, vous y croyez vous SPLOILER que Docteur Strange va utiliser un sort très dangereux pour le plaisir du petit spiderman? Qu il va se laisser enfermer dans un monde miroir ?Et le scénario final est trop facilement deviné des lors qu on comprend qu il y aura forcément annulation du sort initial...Heureusement, on en prend plein la vue et on a l occasion de revoir d autres acteurs du même spiderman réunis dans un meme film et sur un meme rôle ! "
3.5," Ce troisième Spider-Man du MCU tente quelque chose qui n'avait jamais été fait jusqu'à présent: introduire le multiverse (sans l'expliquer néanmoins), en ramenant les personnages des anciens films de l'homme-araignée. C'est bien amené et réussi mais ça n'apporte guère de nouveauté. Le film insiste ainsi trop sur la nostalgie et le fan service. A trop se tourner vers le passé, il délaisse le developpement de l'intrigue présente...Sur le fond, le film repose donc beaucoup sur ce qui a déjà été fait et en reproduit des rebondissements. Sur la forme, Jon Watts n'a pas non plus le talent d'un Sam Raimi, malgré quelques (rares et courtes) belles séquences. Il n'empêche que certaines scènes sont épiques et émouvantes, mais selon moi un peu trop etirées en longueur voir tournées en dérision pour qu'elles soient vraiment impactantes. Elles sont bien aidées par le talent de Tom Holland ou de  spoiler:   Willem Dafoe qui reprend son rôle de bouffon vert à merveille, en tant que principal antagoniste du film ! Bref un film qui n'apporte pas grand chose aux 7 Spider-Man qui l'ont précédé mais qui demeure un vrai divertissement pour tous les amoureux de ce superhéros ! "
4.0," Difficile de donner un avis sans spoiler le film, ce que l'on peut en retenir, c'est qu'il comblera la nouvelle génération, car les effets spéciaux sont naturellement réussis, on en attendait pas moins, mais elle comblera l'ancienne génération pour d'autres raisons. L'univers de Spider man est donc associé cette fois-ci à Dr Strange, comme si l'homme araignée ne pouvait plus soutenir un film à lui seul; alors certes, sans la magie du sorcier le film ne tient pas, mais tout de même, est-ce que les prochains opus vont revenir à l'existentielle de spider man. Difficile à imaginer au regard du niveau des enjeux et de la surenchère déployé dans celui-ci.Tout ici reste jubilatoire, drôle et inventif, le carton de cette fin d'année vient d'arriver sur les écrans, il s'adresse à un très large public, et le succès est annoncé et il est mérité. "
1.0," Film teenager, aucune cohérence, sorti après une heure horrible passée en salle. Si pas fan du genre, n'y allez surtout pas.  "
1.0," Pire film Spiderman de tous les temps. Des blagues nulles, un scénario tiré par les cheveux et un niveau pour les enfants de dix ans. Bref il est loin le temps du Spiderman sorti en 2001…Je dois me faire une raison, les temps changent hélas "
1.5," C'est moche. Non vraiment c'est moche.Esthétiquement le film ne possède pas un visuel plaisant à regarder, les décors sont franchement oubliables et lambdas.Le film est d'une longueur interminable et gâche les différentes surprises du scénario avec une mise en scène paresseuse et des dialogues vraiment malaisant. spoiler:   (notamment avec les trois Spider Man) La continuité entre les différents univers connectés est chaotique. (décors, personnalités etc..)Un peu comme les scènes de combats qui ne sont pas originales et qui n'utilisent pas le potentiel disponible.Et n'étant pas un fan inconditionnel de ce personnage le coté nostalgique ne fonctionne qu'à moitié. Résultat l'ensemble des défauts sont trop importants pour me permettre de profiter du visionnage.Je ne le conseil pas, surtout vu le final qui ne sert à rien..Pour moi ce film sera un succès commercial et va profiter d'un communication importante. Mais au final avec le temps je pense qu'il ne sera pas retenu comme un bon film, mais comme une erreur vu le potentiel loupé disponible. "
1.0," Le MCU ne fait pas du grand cinéma, on le savait. La proposition artistique allait être limité, on le savait. Mais ce film n'a absolument aucune ambition, aucun désir créatif. On est sur une fan fiction de bas étage, mal réalisé et au scénario a dormir dehors dont le seul objectif réside dans du ""plus c'est gros plus ça passe"". Deux jours après je cherche encore un seul putain de point positif au film. C'est sûrement le film que les fans rêvaient d'avoir, mais c'est aussi le pire film Spiderman et un des pires films du MCU. c'est dire. "
